NATURAL DISASTER,TORNADO,NATDTorn,NATD,"Composite tornado sounds, layered and created massive tornadoes. This category often for big hollywood versions of these types of sound.","Cloud, Cyclone, Devil, Downburst, Downbursts, Dust, Duststorm, Duststorms, Eyewall, Funnel, Microburst, Supercell, Twister, Twisters, Updraft, Vortex, Waterspout, Waterspouts, Whirlwind, Whirlwinds, Windstorm",,,,,,,,,,,,,,,,,,,,,,,,,,,,,,,,,,,,,,,,,,,,,,,,,,,,,,,,,,,,
NATURAL DISASTER,TSUNAMI,NATDTsun,NATD,"Composite tidal wave or tsunami scenes, layered and created. This category often for big hollywood versions of these types of sound.","Catastrophic, Earthquake, Flood, Floods, Giant, Mega, Megatsunami, Sea, Sunami, Supertide, Surge, Tidal, Tsunami, Tsunamigenic, Underwater, Wave",,,,,,,,,,,,,,,,,,,,,,,,,,,,,,,,,,,,,,,,,,,,,,,,,,,,,,,,,,,,
NATURAL DISASTER,TYPHOON,NATDThyp,NATD,"Composite typhoons, cyclones or hurricanes. Massive swirling storms. This category often for big hollywood versions of these types of sound.","Cyclone, Cyclones, Cyclonic, Eyewall, Flood, Floods, Hurricane, Hurricanes, Monsoon, Monsoonal, Monsoons, Severe, Storm, Storm., Storms, Strong, Surge, Tempest, Tropical, Tyfoon, Typhon, Wind, Windstorm",,,,,,,,,,,,,,,,,,,,,,,,,,,,,,,,,,,,,,,,,,,,,,,,,,,,,,,,,,,,
NATURAL DISASTER,VOLCANO,NATDVolc,NATD,"Composite big volcano eruptions. Lava, lava bombs, eruptions. This category often for big hollywood versions of these types of sound. See also GEOTHERMAL-LAVA.","Ash, Bombs, Caldera, Calderas, Chasma, Cloud, Crater, Cryovolcano, Erupting, Eruption, Eruptions, Eruptive, Flow, Fumarole, Geothermic, Kilauea, Lahar, Lava, Lavas, Magma, Magmasphere, Magmatic, Mantle, Pinatubo, Pyroclastic, Pyroclastics, Pyroclasts, Rhyolitic, Stratovolcano, Strombolian, Subvolcanic, Tephra, Volcanic, Volcanically, Volcanics, Volcanism, Volcanogenic, Volcanological, Volcanologist, Volcanologists, Volcanology, Vulcan, Vulcanian, Vulcanic, Vulcanism, Vulcano, Vulcanoid, Vulcanology",,,,,,,,,,,,,,,,,,,,,,,,,,,,,,,,,,,,,,,,,,,,,,,,,,,,,,,,,,,,
OBJECTS,BAG,OBJBag,OBJ,"Bags and purses, shopping bags, lunch bags. Really any bag, except Luggage which would go to OBJECTS-LUGGAGE.","Back, Backpack, Briefcase, Camera, Carryall, Clutch, Courier, Drawstring, Duffel, Fanny, Handbag, Knapsack, Messenger, Pack, Pocketbook, Portfolio, Pouch, Purse, Rucksack, Sac, Sachet, Sack, Saddlebag, Satchel, Schoolbag, Shoulder, Sling, Tote",,,,,,,,,,,,,,,,,,,,,,,,,,,,,,,,,,,,,,,,,,,,,,,,,,,,,,,,,,,,
OBJECTS,BOOK,OBJBook,OBJ,"Books, magazines, sounds relating to these. Handling particularly. Some overlap or confusion with PAPER-HANDLE.","Autobiography, Bible, Biography, Book, Bookkeeper, Bookkeeping, Booklet, Bookshop, Bookstore, Brochure, Catalog, Catalogue, Chapter, Codex, Compendium, Compilation, Cookbook, Cover, Daybook, Diary, Dictionary, Directory, Edition, Encyclopedia, Fiction, Guidebook, Handbook, Hardcover, Inventory, Journal, Ledger, Leger, Letters, Literary, Literature, Magazine, Manuscript, Memoir, Non-Fiction, Notebook, Novel, Page, Pamphlet, Paperback, Portfolio, Publication, Publishing, Read, Reading, Scrapbook, Script, Scroll, Sketchbook, Story, Synopsis, Textbook, Tome, Volume, Workbook, Works, Worksheet, Writer, Yearbook",,,,,,,,,,,,,,,,,,,,,,,,,,,,,,,,,,,,,,,,,,,,,,,,,,,,,,,,,,,,
OBJECTS,COIN,OBJCoin,OBJ,"Coins land, toss, drop, handle. Coins being counted, sorted. A bag of coins.","Bank, Cent, Change, Clink, Coinage, Currency, Dime, Dollar, Doubloon, Dump, Euro, Flip, Half-Dollar, Loose, Money, Nickel, Penny, Piggy, Ping, Pound, Quarter, Rouble, Rupee, Shekel, Silver, Spin, Token, Toss, Yen",,,,,,,,,,,,,,,,,,,,,,,,,,,,,,,,,,,,,,,,,,,,,,,,,,,,,,,,,,,,
OBJECTS,CONTAINER,OBJCont,OBJ,"Boxes, tupperware, jewelry boxes, things that hold things, lids, handling, opens and closes.","Aquarium, Baggie, Barrel, Basket, Bin, Box, Breadbox, Canister, Canisters, Capsule, Cardboard, Carton, Case, Casket, Chest, Cistern, Contain, Crate, Dispenser, Dumpster, Enclosure, Flask, Holder, Jar, Jars, Jewelry, Lid, Locker, Package, Pill, Plastic, Receptacle, Receptacles, Reliquary, Toolbox, Tray, Trunk, Tupperware, Vase, Vial",,,,,,,,,,,,,,,,,,,,,,,,,,,,,,,,,,,,,,,,,,,,,,,,,,,,,,,,,,,,
OBJECTS,FASHION,OBJFash,OBJ,"Shoes, belts, clothes, actions involding fashion objects. Makeup, lipstick, etc. Some overlap possible with CLOTH categories. See also OBJECTS-JEWELRY. And OBJECTS-BAG.","Apparel, Attire, Bandana, Belt, Boots, Brush, Clothing, Clutch, Comb, Couture, Eyeliner, Garment, Glasses, Gloves, Handkerchief, Hat, Headband, High-Heels, Lipstick, Makeup, Mascara, Muffs, Outfit, Robe, Sash, Scarf, Shawl, Shoes, Sneakers, Socks, Sunglasses, Suspenders, Ties, Wallet, Wardrobe, Watches",,,,,,,,,,,,,,,,,,,,,,,,,,,,,,,,,,,,,,,,,,,,,,,,,,,,,,,,,,,,
OBJECTS,FURNITURE,OBJFurn,OBJ,"Chairs movement, couch movement, things like that. Wood chair creaks could go in WOOD-FRICTION.","Antiques, Armoires, Bed, Bedframe, Bench, Bookcase, Bookcases, Bookshelf, Buffet, Cabinet, Cabinets, Chair, Chest, Coffee, Console, Couch, Couches, Credenza, Crib, Desk, Dining, Dresser, Dressers, End, Footlocker, Futon, Hutch, Loveseat, Mattress, Mattresses, Nightstand, Ottoman, Rocking, Rugs, Shelf, Shelving, Sideboard, Sofa, Sofas, Stool, Table, Upholstery, Wardrobe",,,,,,,,,,,,,,,,,,,,,,,,,,,,,,,,,,,,,,,,,,,,,,,,,,,,,,,,,,,,
OBJECTS,GARDEN,OBJGrdn,OBJ,"Flower pots, bird feeders, things that you might find and use in a garden. See also TOOLS-GARDEN and MACHINES-GARDEN.","Bath, Bin, Bird, Can, Compost, Composter, Faucet, Feeder, Flower, Gloves, Greenhouse, Hose, Killer, Labels, Plant, Pot, Sculpture, Stake, Stakes, Trellis, Watering, Weed",,,,,,,,,,,,,,,,,,,,,,,,,,,,,,,,,,,,,,,,,,,,,,,,,,,,,,,,,,,,
OBJECTS,GYM,OBJGym,OBJ,"Objects found in a fitness center or school gym, maybe a yoga mat, dumbells. See also MACHINES-GYM.","Ball, Band, Bar, Barbell, Bench, Boxing, Dumbbell, Exercise, Fitness, Foam, Gloves, Jump, Kettlebell, Mat, Medicine, Pull-Up, Rack, Resistance, Roller, Rope, Stepper, Weight, Yoga",,,,,,,,,,,,,,,,,,,,,,,,,,,,,,,,,,,,,,,,,,,,,,,,,,,,,,,,,,,,
OBJECTS,HOUSEHOLD,OBJHsehld,OBJ,"Cleaning products, hangers, towel racks, things around the house that don't fit somewhere else.","Broom, Can, Cleaning, Domestic, Home, House, Mirror, Mop, Rug, Soap, Sponge, Supplies, Trash",,,,,,,,,,,,,,,,,,,,,,,,,,,,,,,,,,,,,,,,,,,,,,,,,,,,,,,,,,,,
OBJECTS,JEWELRY,OBJJewl,OBJ,"Bracelets, necklaces, rings.","Accessories, Adornment, Adornments, Anklet, Bangles, Baubles, Bead, Beaded, Beads, Beadwork, Bling, Bracelet, Bracelets, Bridal, Brooch, Brooches, Cabochons, Charm, Choker, Crown, Cufflink, Cufflinks, Diamond, Diamonds, Earing, Earring, Earrings, Gem, Gemstone, Gemstones, Hairpin, Jewel, Jeweled, Jeweler, Jewelers, Jewelery, Jeweller, Jewellery, Jewels, Locket, Necklace, Necklaces, Nose, Ornament, Ornaments, Pendant, Pendants, Pin, Ring, Tiara, Tie, Trinkets, Watch",,,,,,,,,,,,,,,,,,,,,,,,,,,,,,,,,,,,,,,,,,,,,,,,,,,,,,,,,,,,
OBJECTS,KEYS,OBJKey,OBJ,"Keys jingling, keys movement in lock.","Bicycle, Car, Card, Fob, House, Key, Keychain, Keyes, Keyholes, Keylock, Keyring, Keys, Keyset, Lanyard, Lock, Locker, Mailbox, Master, Office, Padlock, Safe, Skeleton, Unlock, Unlocking, Unlocks",,,,,,,,,,,,,,,,,,,,,,,,,,,,,,,,,,,,,,,,,,,,,,,,,,,,,,,,,,,,
OBJECTS,LUGGAGE,OBJLug,OBJ,"Suitcases, luggage related sounds, handling, opening, packing.","Backpack, Bag, Baggage, Baggages, Bagroom, Bellhop, Carry-On, Carryon, Checked, Cubes, Duffel, Duffels, Duffle, Garment, Knapsack, Knapsacks, Luggage, Packing, Rolling, Rucksack, Samsonite, Satchel, Scale, Skycap, Stow, Stowing, Suitcase, Suitcases, Tag, Toiletry, Trolley, Trunks",,,,,,,,,,,,,,,,,,,,,,,,,,,,,,,,,,,,,,,,,,,,,,,,,,,,,,,,,,,,
OBJECTS,MEDICAL,OBJMed,OBJ,Common objects in hospital or medical office.,"Aid, Bandage, Blood, Brace, Cast, Clamp, Crutches, Cuff, Epipen, Forceps, Gauss, Gauze, Gloves, Hearing, Mask, Meter, Pills, Pressure, Rubber, Scalpel, Specimen, Stethoscope, Surgical, Swab, Syringe, Thermometer",,,,,,,,,,,,,,,,,,,,,,,,,,,,,,,,,,,,,,,,,,,,,,,,,,,,,,,,,,,,
OBJECTS,MISC,OBJMisc,OBJ,Object sounds not fitting another category in this list.,Miscellaneous,,,,,,,,,,,,,,,,,,,,,,,,,,,,,,,,,,,,,,,,,,,,,,,,,,,,,,,,,,,,
OBJECTS,OFFICE,OBJOffc,OBJ,"Things found in an office, staplers, paper cutter etc. Not machines like a printer which would go in MACHINES-OFFICE.","Binder, Business, Calculator, Calendar, Can, Card, Chair, Cutter, Desk, Envelope, Folder, Hole, Notepad, Office, Paper, Paperweight, Post-It, Punch, Report, Scissors, Stapler, Supplies, Trash, Tray, Whiteboard",,,,,,,,,,,,,,,,,,,,,,,,,,,,,,,,,,,,,,,,,,,,,,,,,,,,,,,,,,,,
OBJECTS,PACKAGING,OBJPack,OBJ,"Items commonly used in packaging or packing, so bubblewrap, styrofoam, labels, food packaging.","Bag, Box, Bubble, Cardboard, Corrugated, Crate, Envelope, Foam, Label, Labeling, Labelling, Labels, Mailing, Overwrap, Package, Packagings, Packed, Packing, Padding, Pallet, Paper, Parcel, Peanuts, Shipment, Shipping, Shrink, Strapping, Stretch, Styrofoam, Unwrapping, Wrap, Wrapper, Wrappers, Wrapping, Wrappings",,,,,,,,,,,,,,,,,,,,,,,,,,,,,,,,,,,,,,,,,,,,,,,,,,,,,,,,,,,,
OBJECTS,TAPE,OBJTape,OBJ,Tape and other tacky sticky type sounds as well. Velcro probably better into CLOTH-RIP as that matches the 'sound' better.,"Adhesive, Cellophane, Double, Double-Sided, Duct, Electrical, Flypaper, Gaffer, Glue, Masking, Medical, Packing, Scotch, Sellotape, Stick, Sticky, Transparent, Velcro",,,,,,,,,,,,,,,,,,,,,,,,,,,,,,,,,,,,,,,,,,,,,,,,,,,,,,,,,,,,
OBJECTS,UMBRELLA,OBJUmbr,OBJ,"Umbrella opens and closes. Not for rain on umbrella, which would go in RAIN-CLOTH.","Beach, Brolly, Broly, Bumbershoot, Canopy, Compact, Gamp, Golf, Pagoda, Parasol, Patio, Rain, Sunshade, Travel, Umbrella",,,,,,,,,,,,,,,,,,,,,,,,,,,,,,,,,,,,,,,,,,,,,,,,,,,,,,,,,,,,
OBJECTS,WHEELED,OBJWhled,OBJ,"Non-motorized wheeled carts and dollies. Shopping cart, food cart, baggage cart, baby stroller, dolly, wheelchairs.","Baby, Barrow, Caddie, Carriage, Cart, Caster, Dolly, Gurney, Hand, Handcart, Luggage, Perambulator, Pram, Pushcart, Rolled, Rolling, Shopping, Skateboard, Stroller, Suitcase, Truck, Wagon, Walker, Wheelbarrow, Wheelchair",,,,,,,,,,,,,,,,,,,,,,,,,,,,,,,,,,,,,,,,,,,,,,,,,,,,,,,,,,,,
OBJECTS,WRITING,OBJWrite,OBJ,"Any writing object or performance of writing on any surface. Pens, pencils, crayons, markers.","Blotter, Blotting, Board, Calligraphy, Chalk, Charcoal, Crayon, Drafting, Drawing, Dry, Erase, Eraser, Fountain, Handwriting, Highlighter, Ink, Inscription, Lettering, Letters, Marker, Pen, Pencil, Penned, Penning, Print, Printed, Quill, Script, Sharpie, Signature, Spelled, Spelling, Writer, Written",,,,,,,,,,,,,,,,,,,,,,,,,,,,,,,,,,,,,,,,,,,,,,,,,,,,,,,,,,,,
OBJECTS,ZIPPER,OBJZipr,OBJ,"Pant zippers, bag zippers, luggage zippers.","Bag, Closure, Closures, Fastener, Jacket, Pants, Slider, Tent, Zip, Zipper, Zips",,,,,,,,,,,,,,,,,,,,,,,,,,,,,,,,,,,,,,,,,,,,,,,,,,,,,,,,,,,,
PAPER,FLUTTER,PAPRFltr,PAPR,"Paper and Cardboard. Tossing a group of pages or a book in the air, money flutters as it falls to the ground. Confetti.","Cardboard, Confetti, Crinkling, Fall, Flap, Flapping, Flittering, Flutter, Fluttering, Kraft, Manila, Paper, Papyrus, Parchment, Riffle, Ruffle, Rustle, Rustling, Shake, Tissue, Vellum, Waving",,,,,,,,,,,,,,,,,,,,,,,,,,,,,,,,,,,,,,,,,,,,,,,,,,,,,,,,,,,,
PAPER,FRICTION,PAPRFric,PAPR,Paper and Cardboard. Sliding paper or scraping paper.,"Abrading, Cardboard, Count, Flip, Kraft, Manila, Paper, Papyrus, Parchment, Rub, Rubbing, Scraping, Scratch, Scratching, Scuffing, Sliding, Tissue, Vellum",,,,,,,,,,,,,,,,,,,,,,,,,,,,,,,,,,,,,,,,,,,,,,,,,,,,,,,,,,,,
PAPER,HANDLE,PAPRHndl,PAPR,"Paper and Cardboard. Page turns, magazine handling. Books dropping. Handling paper money. Some overlap or confusion with OBJECTS-BOOK.","Bill, Browse, Cardboard, Clasp, Clutch, Count, Crease, Crinkle, Crumple, Flip, Fold, Grip, Handle, Holder, Kraft, Manila, Page, Paper, Papyrus, Parchment, Peruse, Pull, Roll, Sheet, Throw, Tissue, Toss, Turn, Vellum",,,,,,,,,,,,,,,,,,,,,,,,,,,,,,,,,,,,,,,,,,,,,,,,,,,,,,,,,,,,
PAPER,IMPACT,PAPRImpt,PAPR,"Paper and Cardboard. Heavy paper hits, a rolled up newspaper thwack, a magazine hitting something.","Bump, Cardboard, Drop, Dropped, Hit, Kraft, Magazine, Manila, Newspaper, Paper, Papyrus, Parchment, Punch, Slam, Slap, Smack, Strike, Thump, Tissue, Vellum, Whack",,,,,,,,,,,,,,,,,,,,,,,,,,,,,,,,,,,,,,,,,,,,,,,,,,,,,,,,,,,,
PAPER,MISC,PAPRMisc,PAPR,Paper and Cardboard. Paper sounds not fitting another category in this list.,"Carbon, Cardstock, Construction, Copy, Craft, Crepe, Deed, Document, Dossier, Kraft, Leaf, Letter, Manila, Manuscript, Miscellaneous, Newsprint, Note, Notebook, Page, Paper, Papyrus, Parchment, Printer, Rice, Scroll, Sheet, Stationery, Tissue, Tracing, Vellum, Writing",,,,,,,,,,,,,,,,,,,,,,,,,,,,,,,,,,,,,,,,,,,,,,,,,,,,,,,,,,,,
PAPER,RIP,PAPRRip,PAPR,"Paper and Cardboard. Ripping paper, paper tears.","Cardboard, Kraft, Manila, Paper, Papyrus, Parchment, Rend, Scraps, Shred, Tatter, Tear, Tearing, Tears, Tissue, Tore, Vellum",,,,,,,,,,,,,,,,,,,,,,,,,,,,,,,,,,,,,,,,,,,,,,,,,,,,,,,,,,,,
PAPER,TONAL,PAPRTonl,PAPR,"Paper and Cardboard. Not very common, but tonal paper sounds.","Bowed, Frequency, Harmonic, Kraft, Manila, Melodic, Melodious, Musical, Papyrus, Parchment, Ping, Pitch, Resonance, Resonant, Ring, Shing, Sonorous, Sound, Timbre, Tissue, Tonal, Tone, Vellum",,,,,,,,,,,,,,,,,,,,,,,,,,,,,,,,,,,,,,,,,,,,,,,,,,,,,,,,,,,,
PLASTIC,BREAK,PLASBrk,PLAS,"Plastic breaking, crunches, rips, shatters.","ABS, Acetate, Acrylic, Break, Burst, Chloride, Crack, Crunch, Crush, Demolish, Destroy, Fracture, Fragment, HDPE, Nylon, Polycarbonate, Polypropylene, Polystyrene, Polyvinyl, PVC, Rip, Shatter, Smash, Snap, Splinter, Split",,,,,,,,,,,,,,,,,,,,,,,,,,,,,,,,,,,,,,,,,,,,,,,,,,,,,,,,,,,,
PLASTIC,CRASH & DEBRIS,PLASCrsh,PLAS,"Plastic crashing, groups items falling, group destruction, plastic debris.","ABS, Acetate, Acrylic, Bits, Break, Chloride, Collision, Crash, Debris, Fall, Fragments, HDPE, Nylon, Pieces, Polycarbonate, Polypropylene, Polystyrene, Polyvinyl, PVC, Remains, Rubble, Ruins, Shards, Shatter, Smash, Wreckage",,,,,,,,,,,,,,,,,,,,,,,,,,,,,,,,,,,,,,,,,,,,,,,,,,,,,,,,,,,,
PLASTIC,FRICTION,PLASFric,PLAS,"Plastic friction, such as scrapes, creaks, squeaks, screeching.","Abrasion, ABS, Acetate, Acrylic, Chloride, Creak, Creaks, Friction, Grate, Grind, Grinding, Groan, HDPE, Nylon, Polycarbonate, Polypropylene, Polystyrene, Polyvinyl, PVC, Rasp, Rasping, Rub, Rubbing, Scrape, Scraping, Scratch, Scratching, Screech, Scuffing, Sliding, Squeak, Squeaks, Stress, Wear",,,,,,,,,,,,,,,,,,,,,,,,,,,,,,,,,,,,,,,,,,,,,,,,,,,,,,,,,,,,
PLASTIC,HANDLE,PLASHndl,PLAS,"Plastic handling, handling a toy or remote control. Some overlap with PLASTIC-MOVEMENT possible.","ABS, Acetate, Acrylic, Catch, Chloride, Clasp, Clench, Clutch, Down, Embrace, Grab, Grasp, Grip, Handle, HDPE, Hold, Nylon, Operate, Pickup, Pluck, Polycarbonate, Polypropylene, Polystyrene, Polyvinyl, PVC, Seize, Set, Snap, Take, Throw, Toss, Use",,,,,,,,,,,,,,,,,,,,,,,,,,,,,,,,,,,,,,,,,,,,,,,,,,,,,,,,,,,,
PLASTIC,IMPACT,PLASImpt,PLAS,"Plastic item impact. Hit, drop, big plastic impacts where item does not break. Dropping a plastic object.","ABS, Acetate, Acrylic, Bang, Banging, Bash, Bump, Chloride, Clap, Collide, Colliding, Crash, Crashing, Drop, Dropped, HDPE, Hit, Hitting, Impact, Impacting, Jolt, Knock, Nylon, Polycarbonate, Polypropylene, Polystyrene, Polyvinyl, Pound, Punch, PVC, Ram, Slam, Slamming, Smack, Smacking, Strike, Striking, Thrust, Thump",,,,,,,,,,,,,,,,,,,,,,,,,,,,,,,,,,,,,,,,,,,,,,,,,,,,,,,,,,,,
PLASTIC,MISC,PLASMisc,PLAS,Plastic sounds not fitting another category in this list.,"ABS, Acetate, Acrylic, Artificial, Chloride, Fiber, HDPE, Industrial, Man-Made, Manufactured, Miscellaneous, Non-Biodegradable, Nylon, Plasticine, Polycarbonate, Polyethylene, Polymer, Polypropylene, Polystyrene, Polyurethane, Polyvinyl, PTFE, PVA, PVC, Resin, Synthetic",,,,,,,,,,,,,,,,,,,,,,,,,,,,,,,,,,,,,,,,,,,,,,,,,,,,,,,,,,,,
PLASTIC,MOVEMENT,PLASMvmt,PLAS,"Plastic movement, dragging plastic or drag on plastic, rattles, shakes. See also PLASTIC-HANDLE.","ABS, Acetate, Acrylic, Agitate, Bump, Chloride, Clatter, Drag, HDPE, Jangle, Jiggle, Jingle, Nylon, Polycarbonate, Polypropylene, Polystyrene, Polyvinyl, PVC, Rattle, Roll, Ruffle, Rustle, Shake, Stir, Sway, Vibrate, Wobble",,,,,,,,,,,,,,,,,,,,,,,,,,,,,,,,,,,,,,,,,,,,,,,,,,,,,,,,,,,,
PLASTIC,TONAL,PLASTonl,PLAS,"Plastic tonal sounds, with a musical quality. Probably pretty rare.","ABS, Acetate, Acrylic, Bowed, Chloride, Frequency, Harmonic, HDPE, Melodic, Melodious, Musical, Nylon, Ping, Pitch, Polycarbonate, Polypropylene, Polystyrene, Polyvinyl, PVC, Resonance, Resonant, Ring, Shing, Sonorous, Sound, Timbre, Tonal, Tone",,,,,,,,,,,,,,,,,,,,,,,,,,,,,,,,,,,,,,,,,,,,,,,,,,,,,,,,,,,,
RAIN,CLOTH,RAINClth,RAIN,"Rain on cloth, like a person's clothes, or more likely a patio umbrella, awning.","Awning, Cloth, Cotton, Drizzle, Jacket, Precipitation, Rain, Raincoat, Rainwear, Tarp, Tent, Umbrella, Waterproof",,,,,,,,,,,,,,,,,,,,,,,,,,,,,,,,,,,,,,,,,,,,,,,,,,,,,,,,,,,,
RAIN,CONCRETE,RAINConc,RAIN,Rain on asphalt or concrete or patio tile. Rain on a hard slappy solid surface.,"Asphalt, Brick, Cement, Drizzle, Masonry, Path, Pavement, Precipitation, Rain, Sidewalk, Street",,,,,,,,,,,,,,,,,,,,,,,,,,,,,,,,,,,,,,,,,,,,,,,,,,,,,,,,,,,,
RAIN,GENERAL,RAIN,RAIN,"General downpour, rain on mixed materials.","Damp, Deluge, Downpour, Drenched, Drizzle, Mist, Monsoon, Precipitate, Precipitation, Rain, Rainfall, Raining, Rains, Rainstorm, Rainy, Shower, Sprinkle, Torrent, Wet",,,,,,,,,,,,,,,,,,,,,,,,,,,,,,,,,,,,,,,,,,,,,,,,,,,,,,,,,,,,
RAIN,GLASS,RAINGlas,RAIN,"Rain on a glass roof like a sunroof, or rain blown against a window as well.","Drizzle, Glass, Greenhouse, Pane, Precipitation, Rain, Sheet, Skylight, Sunroof, Window, Windshield",,,,,,,,,,,,,,,,,,,,,,,,,,,,,,,,,,,,,,,,,,,,,,,,,,,,,,,,,,,,
RAIN,INTERIOR,RAINInt,RAIN,"Interior recordings of Rain, from inside house or barn, or vehicle.","Drizzle, Indoor, Interior, Precipitation, Rain, Rainstorm, Roof, Sunroof, Windshield",,,,,,,,,,,,,,,,,,,,,,,,,,,,,,,,,,,,,,,,,,,,,,,,,,,,,,,,,,,,
RAIN,METAL,RAINMetl,RAIN,"Rain on a metal surface, so exterior rain on a car, or metal sheet, metal roof.","Can, Car, Drizzle, Gutters, Metal, Ping, Precipitation, Rain, Roof, Tin",,,,,,,,,,,,,,,,,,,,,,,,,,,,,,,,,,,,,,,,,,,,,,,,,,,,,,,,,,,,
RAIN,PLASTIC,RAINPlas,RAIN,"Rain on plastic or vinyl surfaces, like a grill cover, or a plastic shed.","Drizzle, Plastic, Plexiglass, Precipitation, Rain, Vinyl",,,,,,,,,,,,,,,,,,,,,,,,,,,,,,,,,,,,,,,,,,,,,,,,,,,,,,,,,,,,
RAIN,VEGETATION,RAINVege,RAIN,"Rain on plants, leaves and grass. Jungle or tropical rain on plant leaves.","Drizzle, Foliage, Grass, Jungle, Leaf, Leaves, Plants, Precipitation, Rainforest, Tree, Vegetation",,,,,,,,,,,,,,,,,,,,,,,,,,,,,,,,,,,,,,,,,,,,,,,,,,,,,,,,,,,,
RAIN,WATER,RAINWatr,RAIN,"Rain on water, puddles, lakes, ponds.","Drizzle, Droplets, Drops, Lake, Pond, Precipitation, Puddle, Rain, Ripples, Surface",,,,,,,,,,,,,,,,,,,,,,,,,,,,,,,,,,,,,,,,,,,,,,,,,,,,,,,,,,,,
RAIN,WOOD,RAINWood,RAIN,"Rain on wood surfaces, so a deck for example.","Barn, Deck, Drizzle, Floor, Precipitation, Rain, Roof, Shed, Wood",,,,,,,,,,,,,,,,,,,,,,,,,,,,,,,,,,,,,,,,,,,,,,,,,,,,,,,,,,,,
ROBOTS,MISC,ROBTMisc,ROBT,Robot sounds not fitting another category in this list.,"AI, Android, Androids, Artificial, Automatons, Beings, Bionic, Bot, Cybernetic, Cyborg, Cyborgs, Droid, Droids, Humanoid, Lifeforms, Machines, Mechs, Synthetic",,,,,,,,,,,,,,,,,,,,,,,,,,,,,,,,,,,,,,,,,,,,,,,,,,,,,,,,,,,,
ROBOTS,MOVEMENT,ROBTMvmt,ROBT,"Complex robot movement, servos, possible robot hovering and flying. See also MOTORS-SERVO.","Actuator, AI, Android, Androids, Automatons, Bionic, Bot, Cybernetic, Cyborg, Cyborgs, Droid, Droids, Hydraulic, Machines, Mechanism, Mechs, Pneumatic, Servo, Solenoid, Synthetic",,,,,,,,,,,,,,,,,,,,,,,,,,,,,,,,,,,,,,,,,,,,,,,,,,,,,,,,,,,,
ROBOTS,VOCAL,ROBTVox,ROBT,"Droid and robot vocals, R2D2 would go here. Any manner of vocalizing robot. More expressive than a beep/UI. Robot language.","AI, Android, Androids, Artificial, Automatons, Beep, Beings, Bionic, Bot, Chirp, Cybernetic, Cyborg, Cyborgs, Droid, Droids, Lifeforms, Machines, Mechs, R2D2, Synthetic",,,,,,,,,,,,,,,,,,,,,,,,,,,,,,,,,,,,,,,,,,,,,,,,,,,,,,,,,,,,
ROCKS,BREAK,ROCKBrk,ROCK,"Rock cracks, breaks, rips or shatters. More isolated and singular cracks and breaks.","Apart, Basalt, Boulders, Break, Breaks, Burst, Chip, Cobblestones, Crack, Cracks, Crumble, Crunches, Crush, Demolish, Destroy, Disintegrate, Formations, Fossil, Fracture, Fragment, Geology, Gneiss, Granite, Gravel, Gravelly, Hammered, Hammering, Hammers, Igneous, Limestone, Marble, Metamorphic, Minerals, Obsidian, Pebbles, Pickaxe, Pumice, Quarry, Quartzite, Rips, Sandstone, Schist, Scree, Sedimentary, Shale, Shatter, Shatters, Shingles, Slab, Slate, Slates, Smash, Snap, Specimens, Splinter, Split, Stones",,,,,,,,,,,,,,,,,,,,,,,,,,,,,,,,,,,,,,,,,,,,,,,,,,,,,,,,,,,,
ROCKS,CRASH & DEBRIS,ROCKCrsh,ROCK,"Rock crashes and debris, so a huge rock crash, collapse. Or isolated debris. See also NATURAL DISASTER-AVALANCHE.","Apart, Avalanche, Basalt, Boulders, Break, Clastic, Cobblestones, Collision, Crack, Crumble, Debris, Disintegrate, Down, Fall, Formations, Fracture, Fragment, Fragments, Geology, Gneiss, Granite, Gravel, Gravelly, Gritty, Igneous, Limestone, Marble, Metamorphic, Minerals, Moraine, Obsidian, Ore, Pebbles, Pumice, Quartzite, Remains, Rockfall, Rockslide, Rocky, Rubble, Ruins, Sandstone, Schist, Scree, Sedimentary, Shale, Shards, Shatter, Shingles, Slab, Slate, Slates, Smash, Specimens, Splinter, Stones, Up, Wreckage",,,,,,,,,,,,,,,,,,,,,,,,,,,,,,,,,,,,,,,,,,,,,,,,,,,,,,,,,,,,
ROCKS,FRICTION,ROCKFric,ROCK,"Rock creaks, scrapes... the stress of rock about to break.","Abrade, Abrasion, Basalt, Boulders, Cobblestones, Creaks, Erode, Formations, Geology, Gneiss, Granite, Grate, Gravel, Gravelly, Grind, Grinding, Igneous, Limestone, Marble, Metamorphic, Minerals, Obsidian, Pebbles, Pumice, Quartzite, Rasp, Rasping, Rub, Rubbing, Sandstone, Schist, Scour, Scrape, Scrapes, Scraping, Scratch, Scratching, Scree, Screech, Scuffing, Sedimentary, Shale, Shingles, Slab, Slate, Slates, Sliding, Specimens, Squeaks, Stones, Stress, Wear, Whet, Whetstone",,,,,,,,,,,,,,,,,,,,,,,,,,,,,,,,,,,,,,,,,,,,,,,,,,,,,,,,,,,,
ROCKS,HANDLE,ROCKHndl,ROCK,"Rock handing, picking up or digging through rocks, bricks. Some overlap with ROCKS-MOVEMENT possible.","Basalt, Boulders, Carry, Catch, Clasp, Clench, Clutch, Cobblestones, Down, Embrace, Formations, Geology, Gneiss, Grab, Granite, Grasp, Gravel, Gravelly, Grip, Handle, Hold, Igneous, Lift, Limestone, Manipulate, Marble, Metamorphic, Minerals, Move, Obsidian, Pebbles, Pickup, Pumice, Quartzite, Sandstone, Schist, Scree, Sedimentary, Seize, Set, Shale, Shingles, Slab, Slate, Slates, Specimens, Stones, Take, Throw, Toss",,,,,,,,,,,,,,,,,,,,,,,,,,,,,,,,,,,,,,,,,,,,,,,,,,,,,,,,,,,,
ROCKS,IMPACT,ROCKImpt,ROCK,"Rock falling, dropping without breaking, or something hit with a rock, a big rock impact.","Bang, Banging, Basalt, Bash, Boulders, Bump, Chop, Clang, Clap, Clink, Clunk, Cobblestones, Collide, Colliding, Collision, Crash, Crashing, Drop, Dropped, Formations, Geology, Gneiss, Granite, Gravel, Gravelly, Hit, Hitting, Igneous, Impact, Impacting, Jolt, Knock, Limestone, Marble, Metamorphic, Minerals, Obsidian, Pebbles, Pound, Pumice, Quartzite, Ram, Sandstone, Schist, Scree, Sedimentary, Shale, Shingles, Shock, Slab, Slam, Slamming, Slate, Slates, Smack, Smacking, Specimens, Stones, Strike, Striking, Thrust, Thud",,,,,,,,,,,,,,,,,,,,,,,,,,,,,,,,,,,,,,,,,,,,,,,,,,,,,,,,,,,,
ROCKS,MISC,ROCKMisc,ROCK,Rock sounds not fitting another category in this list.,"Basalt, Boulders, Cobblestones, Formations, Geology, Gneiss, Granite, Gravel, Gravelly, Igneous, Limestone, Marble, Metamorphic, Minerals, Miscellaneous, Obsidian, Pebbles, Pumice, Quartzite, Sandstone, Schist, Scree, Sedimentary, Shale, Shingles, Slab, Slate, Slates, Specimens, Stones",,,,,,,,,,,,,,,,,,,,,,,,,,,,,,,,,,,,,,,,,,,,,,,,,,,,,,,,,,,,
ROCKS,MOVEMENT,ROCKMvmt,ROCK,"Rock dragging, or dragging across a rock surface, rocks shaking or rattling. See also ROCKS-HANDLE.","Agitate, Basalt, Boulders, Cobblestones, Displace, Drag, Fall, Formations, Geology, Glide, Gneiss, Granite, Gravel, Gravelly, Igneous, Jiggle, Jolt, Limestone, Marble, Metamorphic, Minerals, Move, Obsidian, Oscillate, Pebbles, Pumice, Quake, Quartzite, Rattle, Rockslide, Roll, Sandstone, Schist, Scree, Sedimentary, Shake, Shale, Shift, Shingles, Shudder, Slab, Slate, Slates, Slide, Slip, Slipping, Slips, Specimens, Stones, Sway, Swing, Teeter, Topple, Tremble, Tumble, Vibrate, Wobble",,,,,,,,,,,,,,,,,,,,,,,,,,,,,,,,,,,,,,,,,,,,,,,,,,,,,,,,,,,,
ROCKS,TONAL,ROCKTonl,ROCK,"Tonal rocks, probably pretty rare. Singing rocks.","Basalt, Boulders, Bowed, Cobblestones, Formations, Frequency, Geology, Gneiss, Granite, Gravel, Gravelly, Harmonic, Igneous, Limestone, Marble, Melodic, Melodious, Metamorphic, Minerals, Musical, Obsidian, Pebbles, Ping, Pitch, Pumice, Quartzite, Resonance, Resonant, Ring, Sandstone, Schist, Scree, Sedimentary, Shale, Shing, Shingles, Slab, Slate, Slates, Sonorous, Sound, Specimens, Stones, Timbre, Tonal, Tone",,,,,,,,,,,,,,,,,,,,,,,,,,,,,,,,,,,,,,,,,,,,,,,,,,,,,,,,,,,,
ROPE,CREAK,ROPECreak,ROPE,"Rope stretches and creaks, people hanging from nooses.. Ship rope creaks. Tension of rope stretches.","Cable, Cord, Creak, Extend, Lengthen, Line, Paracord, Pull, Straighten, Strain, Stretch, Taut, Tension, Tight, Tug, Twine, Yank",,,,,,,,,,,,,,,,,,,,,,,,,,,,,,,,,,,,,,,,,,,,,,,,,,,,,,,,,,,,
