GORE,MISC,GOREMisc,GORE,Gore sounds not fitting another category in this list.,"Beheadings, Bloodbaths, Carnage, Decapitations, Disembowelment, Dismemberment, Dismemberments, Gore, Gory, Graphic, Gruesome, Gruesomeness, Macabre, Miscellaneous, Mutilation, Offal, Remains, Scalpings, Slaughter, Viscera",,,,,,,,,,,,,,,,,,,,,,,,,,,,,,,,,,,,,,,,,,,,,,,,,,,,,,,,,,,,
GORE,OOZE,GOREOoze,GORE,"Gore gross oozing liquid, open wounds, possible overlap with LIQUID categories, but this hyperreal and over the top.","Blob, Burbling, Bursting, Congeal, Congealed, Congealing, Discharge, Drippy, Emanate, Exude, Exuded, Exudes, Exuding, Flow, Gelatin, Gobs, Goo, Goopy, Guck, Gunk, Gushes, Jelly, Liquidy, Muck, Mucus, Mush, Ooze, Oozy, Permeate, Pus, Putrefy, Putrefying, Putrescence, Putrescent, Putrid, Seep, Seeped, Seeping, Seeps, Slime, Sliminess, Slithering, Sludge, Slurry, Spewing, Splattered, Spurting, Squishy, Suppurate, Suppurating, Syrup, Viscous",,,,,,,,,,,,,,,,,,,,,,,,,,,,,,,,,,,,,,,,,,,,,,,,,,,,,,,,,,,,
GORE,SOURCE,GORESrce,GORE,"Recordings meant as source for GORE sounds, smashing a watermelon, stabbing a pumpkin, etc.","Arteries, Bones, Brain, Cartilage, Cord, Entrails, Eyeballs, Guts, Intestines, Ligaments, Limbs, Matter, Muscles, Organs, Raw, Skin, Skull, Source, Spinal, Teeth, Tendons, Veins",,,,,,,,,,,,,,,,,,,,,,,,,,,,,,,,,,,,,,,,,,,,,,,,,,,,,,,,,,,,
GORE,SPLAT,GORESplt,GORE,"Gore splats, gross splats of gooey stuff. A body or head exploding and hitting the wall. Hyperreal.","Gack, Glob, Globs, Glop, Goo, Goop, Goosh, Intestine, Juicy, Organ, Plop, Plopping, Plops, Poop, Smear, Snot, Spack, Spattered, Spatters, Spittle, Splatter, Splattered, Splatters, Splatting, Splodge, Splodges, Splosh, Splotch, Splotched, Splotches, Splotching, Squish",,,,,,,,,,,,,,,,,,,,,,,,,,,,,,,,,,,,,,,,,,,,,,,,,,,,,,,,,,,,
GORE,SQUISH,GORESqsh,GORE,"Gore squishes, disgusting squishes or flesh and organs. A dinosaur stepping on a person and squishing them.","Compress, Goosh, Intestine, Juicy, Macerate, Mash, Mashed, Mashing, Moosh, Mush, Mushed, Mushy, Organ, Slop, Splat, Squash, Squashed, Squashing, Squashy, Squeezed, Squeezes, Squeezing, Squelch, Squelchy, Squidge, Squiggle, Squirty, Squish, Squishing, Squishy",,,,,,,,,,,,,,,,,,,,,,,,,,,,,,,,,,,,,,,,,,,,,,,,,,,,,,,,,,,,
GORE,STAB,GOREStab,GORE,Gore sharp stabs and sword pulls. That classic sound of someone being impaled. More crunchy than a SQUISH.,"Arrow, Behead, Cut, Dagger, Decapitate, Disembowel, Dismember, Eviscerate, Flay, Impale, Impaling, Jab, Jabbed, Jabbing, Jugular, Knife, Knifed, Knifing, Mutilate, Needle, Penetrate, Pierce, Poke, Prod, Puncture, Shank, Skewer, Slash, Slashing, Slice, Spear, Spike, Stab, Sword, Syringe, Thrust, Vorpal",,,,,,,,,,,,,,,,,,,,,,,,,,,,,,,,,,,,,,,,,,,,,,,,,,,,,,,,,,,,
GUNS,ANTIQUE,GUNAntq,GUN,"Old black powder weapons, muskets.","Arquebus, Arquebuses, Black, Blunderbuss, Breechloader, Breechloaders, Breechloading, Caplock, Carabine, Civil, Derringer, Derringers, Firearms, Firelock, Flintlock, Gatling, Gun, Gunflint, Harquebus, Historical, Lockplate, Lockwork, Long, Matchlock, Matchlocks, Musket, Musketeer, Musketry, Muskets, Muzzleloader, Muzzleloaders, Muzzleloading, Old, Old-Fashioned, Pepperbox, Powder, Powderhorn, Revolutionary, Rifle, Sixgun, Sixguns, Traditional, Victorian, Vintage, War, West, Wheellock, WWI, WWII",,,,,,,,,,,,,,,,,,,,,,,,,,,,,,,,,,,,,,,,,,,,,,,,,,,,,,,,,,,,
GUNS,ARTILLERY,GUNArtl,GUN,"Modern big guns, guns that launch shells. Not CANNONS which have their own group.","Anti-Aircraft, Anti-Tank, Antiaircraft, Antiarmor, Antitank, Armaments, Artillerie, Artillery, Ballistics, Bazooka, Cannon, Field, Firepower, Heavy, Howitzer, Howitzers, Incoming, Launcher, Light, Missile, Mortar, Mortars, Munitions, Naval, Ordnance, Rocket, Shellfire, Shelling, Tank, Volley, Weapons",,,,,,,,,,,,,,,,,,,,,,,,,,,,,,,,,,,,,,,,,,,,,,,,,,,,,,,,,,,,
GUNS,AUTOMATIC,GUNAuto,GUN,"Fully automatic capable weapons, even when firing singly. Machine guns.","Ak-47, AK47, Automatic, Firearms, Full-Auto, Gatlin, Gatling, Gun, Kalashnikov, M16, M1919, M249, Machine, Maxim, Minigun, Sten, Submachine, Submachinegun, Tommy, Uzi",,,,,,,,,,,,,,,,,,,,,,,,,,,,,,,,,,,,,,,,,,,,,,,,,,,,,,,,,,,,
GUNS,CANNON,GUNCano,GUN,"Pirate and Civil War cannons, for modern artillery see GUNS-ARTILLERY.","Ball, Barrel, Black, Blast, Cannonade, Cannonades, Cannonball, Cannonballs, Cannoneer, Cannoneers, Cannonry, Fuse, Gunpowder, Pirate, Powder, Primer, Projectile, Shot, Siege",,,,,,,,,,,,,,,,,,,,,,,,,,,,,,,,,,,,,,,,,,,,,,,,,,,,,,,,,,,,
GUNS,HANDLE,GUNHndl,GUN,"Alongside GUN-MECHANISM, but specifically gun handling, grabs, holstering, dropping, catching.","Catch, Chambering, Clearing, Clip, Cock, Cocking, Discharge, Draw, Drawing, Drop, Dry-Fire, Dry-Firing, Ejecting, Grab, Grasp, Grip, Gun, Gunstock, Handgrip, Handle, Hold, Holster, Holstering, Load, Loading, Throw, Toss, Unloading",,,,,,,,,,,,,,,,,,,,,,,,,,,,,,,,,,,,,,,,,,,,,,,,,,,,,,,,,,,,
GUNS,HITECH,GUNTech,GUN,"Not quite a sci-fi Laser Gun, but something more advanced than a normal gun, a rail gun for example.","7, Biometric, Bond, Firearms, Gun, James, Night, Rail, Scope, Smart, Spy, Vision",,,,,,,,,,,,,,,,,,,,,,,,,,,,,,,,,,,,,,,,,,,,,,,,,,,,,,,,,,,,
GUNS,MECHANISM,GUNMech,GUN,"Gun various mechanical sounds, clips, cocking, bolt slides.","Assembly, Barrel, Bolt, Brake, Bullet, Buttplate, Chamber, Clip, Cock, Cocking, Cylinder, Firearms, Firing, Flash, Grip, Guard, Gun, Hammer, Loading, Magazine, Mechanics, Mechanism, Muzzle, Pin, Pistol, Rattle, Release, Safety, Sear, Slide, Stock, Stop, Suppressor, Trigger",,,,,,,,,,,,,,,,,,,,,,,,,,,,,,,,,,,,,,,,,,,,,,,,,,,,,,,,,,,,
GUNS,MISC,GUNMisc,GUN,Gun sounds not fitting another category in this list. BULLETS has its own category.,"Air, Firearms, Flare, Paintball",,,,,,,,,,,,,,,,,,,,,,,,,,,,,,,,,,,,,,,,,,,,,,,,,,,,,,,,,,,,
GUNS,PISTOL,GUNPis,GUN,Handguns and pistols.,"&, 9mm, Beretta, Browning, Colt, Double-Action, Firearms, Glock, Handgun, Handguns, Luger, Pistol, Pistole, Pistolet, PPK, Revolver, Revolvers, Ruger, Sauer, Semi-Automatic, Sidearm, Sig, Single-Action, Six-Shooter, Smith, Starter, Walther, Wesson",,,,,,,,,,,,,,,,,,,,,,,,,,,,,,,,,,,,,,,,,,,,,,,,,,,,,,,,,,,,
GUNS,RIFLE,GUNRif,GUN,"Rifles, single shot and semi-automatic.","AK-47, AR-15, Arisaka, Assault, Bolt-Action, Breechloader, Carabine, Carbine, Carbines, Casull, Firearms, Garand, Gun, Hunting, Lever-Action, Long, Luger, M1, M16, Mauser, Powell, Remington, Riffle, Rifle, Rifleman, Riflemen, Riflery, Rimfire, Ruger, Semi-Automatic, Sniper, Sporting, Winchester",,,,,,,,,,,,,,,,,,,,,,,,,,,,,,,,,,,,,,,,,,,,,,,,,,,,,,,,,,,,
GUNS,SHOTGUN,GUNShotg,GUN,"Shotguns, single, dual, pump.","Barrel, Break-Action, Coach, Double, Double-Barreled, Gun, Mossberg, Over-Under, Pump-Action, Sawed-Off, Scattergun, Shotgun, Slug, Winchester",,,,,,,,,,,,,,,,,,,,,,,,,,,,,,,,,,,,,,,,,,,,,,,,,,,,,,,,,,,,
GUNS,SUPPRESSED,GUNSupr,GUN,"Silenced Weapons, silencers.","7, Assassin, Bond, James, Rifle, Silenced, Silencer, Sniper, Spy",,,,,,,,,,,,,,,,,,,,,,,,,,,,,,,,,,,,,,,,,,,,,,,,,,,,,,,,,,,,
HORNS,AIR POWERED,HORNAir,HORN,"Air horns, as in handheld compressed air horns, huge factory air horns. A fog horn. BOATS-HORN has it's own category for ship and ferry horns, as does TRAINS-HORN.","Air, Factory, Fog",,,,,,,,,,,,,,,,,,,,,,,,,,,,,,,,,,,,,,,,,,,,,,,,,,,,,,,,,,,,
HORNS,CELEBRATION,HORNCele,HORN,"Party horns, from small party horns to vuvuzelas.","Bugle, Ceremonial, Fanfare, Festive, Heraldic, Horns, Party, Processional, Toot, Triumphal, Trumpets, Victory, Vuvuzela",,,,,,,,,,,,,,,,,,,,,,,,,,,,,,,,,,,,,,,,,,,,,,,,,,,,,,,,,,,,
HORNS,MISC,HORNMisc,HORN,"Horn sounds not fitting another category in this list, for example hunting calls. Not brass musical instruments which has it's own category in MUSICAL.","Bugle, Call, Duck, Elk, Fox, Hunting",,,,,,,,,,,,,,,,,,,,,,,,,,,,,,,,,,,,,,,,,,,,,,,,,,,,,,,,,,,,
HORNS,TRADITIONAL,HORNTrad,HORN,"Rams horns, conches, alpine horns, old traditional horns, medieval battle horns.","Alpenhorn, Alphorn, Alpine, Battle, Bugle, Conch, Hunting, Shell, Shofar, War",,,,,,,,,,,,,,,,,,,,,,,,,,,,,,,,,,,,,,,,,,,,,,,,,,,,,,,,,,,,
HUMAN,BLOW,HMNBlow,HMN,"Blowing air, blowing up a balloon, blowing out candles, etc. See also HUMAN-BREATH for less forceful breathing.","Adult, Blow, Child, Female, Male, Man, Person, Woman",,,,,,,,,,,,,,,,,,,,,,,,,,,,,,,,,,,,,,,,,,,,,,,,,,,,,,,,,,,,
HUMAN,BREATH,HMNBrth,HMN,"Breathing, normal to heavy, big inhales, sighs.","Adult, Asphyxiate, Asthma, Breath, Breathing, Breaths, Child, Exhalation, Exhale, Exhaled, Exhales, Exhaling, Female, Gasp, Gasping, Heave, Huff, Huffing, Hyperventilate, Hyperventilating, Inhalation, Inhale, Inhaled, Inhales, Inhaling, Labored, Male, Man, Meditation, Pant, Panting, Person, Puffing, Respiration, Sigh, Suffocate, Suffocates, Suffocating, Wheeze, Wheezing, Whoop, Woman",,,,,,,,,,,,,,,,,,,,,,,,,,,,,,,,,,,,,,,,,,,,,,,,,,,,,,,,,,,,
HUMAN,BURP,HMNBurp,HMN,"Human belches, burps.","Adult, Belch, Belching, Burp, Burping, Child, Female, Hiccup, Male, Man, Person, Woman",,,,,,,,,,,,,,,,,,,,,,,,,,,,,,,,,,,,,,,,,,,,,,,,,,,,,,,,,,,,
HUMAN,COUGH,HMNCough,HMN,Human coughs and coughing.,"Adult, Ahem, Bronchitis, Child, Choking, Clear, Clearing, Convulse, Coughing, Covid, Expectoration, Female, Gag, Hack, Hacking, Hiccough, Hiccoughing, Hiccoughs, Hoarse, Male, Man, Person, Throat, Wet, Whooping, Woman",,,,,,,,,,,,,,,,,,,,,,,,,,,,,,,,,,,,,,,,,,,,,,,,,,,,,,,,,,,,
HUMAN,HEARTBEAT,HMNHart,HMN,"Heartbeats, both literal as in a Dr. office, and stylized or designed heartbeats.","Adult, Arrhythmia, Arrhythmic, Arrythmia, Beating, Cardiac, Child, Coronary, EKG, Female, Fetal, Fibrillation, Heart, Male, Man, Palpitate, Palpitates, Palpitating, Palpitation, Palpitations, Person, Pulsate, Pulsated, Pulsates, Pulsating, Pulse, Rate, Rhythm, Woman",,,,,,,,,,,,,,,,,,,,,,,,,,,,,,,,,,,,,,,,,,,,,,,,,,,,,,,,,,,,
HUMAN,KISS,HMNKiss,HMN,Human kissing.,"Adult, Child, Female, French, Hickey, Kiss, Lips, Make, Male, Man, Necking, Out, Peck, Person, Smooch, Smooching, Snog, Woman",,,,,,,,,,,,,,,,,,,,,,,,,,,,,,,,,,,,,,,,,,,,,,,,,,,,,,,,,,,,
HUMAN,MISC,HMNMisc,HMN,Human sounds not fitting another category in this list.,"Adult, Child, Female, Male, Man, Miscellaneous, Person, Woman",,,,,,,,,,,,,,,,,,,,,,,,,,,,,,,,,,,,,,,,,,,,,,,,,,,,,,,,,,,,
HUMAN,PEE,HMNPee,HMN,Human urinating.,"Adult, Child, Female, Male, Man, Micturition, Peeing, Person, Piss, Tinkle, Urinate, Urinating, Urination, Wee, Wizz, Woman",,,,,,,,,,,,,,,,,,,,,,,,,,,,,,,,,,,,,,,,,,,,,,,,,,,,,,,,,,,,
HUMAN,SKIN,HMNSkin,HMN,"Human skin, Scratching, handshakes, skin on skin action, back rubbing, etc.","Adult, Backrub, Brush, Caress, Child, Clap, Dermis, Female, Flick, Grab, Hand, Handshake, Itch, Male, Man, Massage, Pat, Person, Pores, Rash, Rub, Rubbing, Scratch, Scratching, Skin, Slap, Tap, Woman",,,,,,,,,,,,,,,,,,,,,,,,,,,,,,,,,,,,,,,,,,,,,,,,,,,,,,,,,,,,
HUMAN,SNEEZE,HMNSneez,HMN,Human sneezing.,"Achoo, Adult, Ah-Choo, Ahchoo, Allergic, Allergy, Child, Female, Fever, Hay, Male, Man, Nasal, Person, Sinus, Sneeze, Woman",,,,,,,,,,,,,,,,,,,,,,,,,,,,,,,,,,,,,,,,,,,,,,,,,,,,,,,,,,,,
HUMAN,SNIFF,HMNSniff,HMN,"Human sniffing, smelling.","Adult, Child, Female, Inhalation, Inhale, Male, Man, Nose, Odor, Person, Smell, Sniff, Sniffing, Sniffle, Snivel, Snort, Snorting, Snuffle, Whiff, Woman",,,,,,,,,,,,,,,,,,,,,,,,,,,,,,,,,,,,,,,,,,,,,,,,,,,,,,,,,,,,
HUMAN,SNORE,HMNSnor,HMN,Human snoring.,"Adult, Apnea, Breathing, Child, Congested, Doze, Dozing, Female, Heavy, Male, Man, Person, Slumber, Snooze, Snore, Snoring, Woman, ZZZ",,,,,,,,,,,,,,,,,,,,,,,,,,,,,,,,,,,,,,,,,,,,,,,,,,,,,,,,,,,,
HUMAN,SPIT,HMNSpit,HMN,Human spits.,"Adult, Child, Drool, Expectoration, Female, Gob, Hawk, Hock, Male, Man, Mucus, Person, Phlegm, Saliva, Slobber, Spew, Spit, Spitoon, Spitting, Spittle, Spittoon, Sputum, Woman",,,,,,,,,,,,,,,,,,,,,,,,,,,,,,,,,,,,,,,,,,,,,,,,,,,,,,,,,,,,
HUMAN,VOMIT,HMNVomit,HMN,Human vomiting.,"Adult, Barf, Barfing, Child, Chunder, Expunge, Female, Gag, Gagging, Heave, Hurl, Male, Man, Nausea, Nauseous, Person, Puke, Pukes, Reflex, Reflux, Regurgitate, Regurgitated, Regurgitation, Retch, Retched, Retching, Seasick, Spew, Throwing, Up, Upchuck, Vomit, Vomitus, Woman",,,,,,,,,,,,,,,,,,,,,,,,,,,,,,,,,,,,,,,,,,,,,,,,,,,,,,,,,,,,
ICE,BREAK,ICEBrk,ICE,"Ice cracks, breaks, shatters. Any ice breaking that is fairly singular or isolated, large or small.","Apart, Break, Burst, Chip, Crack, Crumble, Crunch, Crush, Cube, Demolish, Destroy, Disintegrate, Fracture, Fragment, Ice, Iceberg, Icicle, Rips, Shatter, Smash, Snap, Splinter, Split",,,,,,,,,,,,,,,,,,,,,,,,,,,,,,,,,,,,,,,,,,,,,,,,,,,,,,,,,,,,
ICE,CRASH & DEBRIS,ICECrsh,ICE,Ice large crashes and isolated debris go here. Iceberg calving.,"Apart, Break, Collision, Crash, Crevasse, Crush, Cube, Debris, Destroy, Fall, Fragments, Ice, Iceberg, Icicle, Pulverize, Remains, Rubble, Shards, Shatter, Smash, Wreck",,,,,,,,,,,,,,,,,,,,,,,,,,,,,,,,,,,,,,,,,,,,,,,,,,,,,,,,,,,,
ICE,FRICTION,ICEFric,ICE,"Dry ice may go here, but often it's a metallic sound too, but ice scrapes, squeaks, creaks.","Abrade, Abrasion, Buff, Creak, Cube, Grind, Grinding, Hone, Ice, Icicle, Polish, Rasp, Rasping, Rub, Rubbing, Sand, Scour, Scrape, Scraping, Scratching, Screech, Scuffing, Sliding, Squeak, Stress, Wear",,,,,,,,,,,,,,,,,,,,,,,,,,,,,,,,,,,,,,,,,,,,,,,,,,,,,,,,,,,,
ICE,HANDLE,ICEHndl,ICE,"Ice handling, picking up ice. Some overlap with ICE-MOVEMENT possible.","Catch, Clasp, Clench, Clutch, Cube, Down, Embrace, Grab, Grasp, Grip, Handle, Hold, Ice, Icicle, Pickup, Pluck, Seize, Set, Take, Throw, Toss",,,,,,,,,,,,,,,,,,,,,,,,,,,,,,,,,,,,,,,,,,,,,,,,,,,,,,,,,,,,
ICE,IMPACT,ICEImpt,ICE,"Pieces of ice dropping (without breaking). Ice hits, solid ice impacts that don't break.","Bang, Banging, Bash, Bump, Chop, Clang, Clap, Clink, Clunk, Collide, Colliding, Crash, Crashing, Cube, Drop, Hit, Hitting, Ice, Icicle, Impact, Impacting, Jolt, Knock, Pound, Ram, Slam, Slamming, Smack, Smacking, Smash, Strike, Striking, Thrust",,,,,,,,,,,,,,,,,,,,,,,,,,,,,,,,,,,,,,,,,,,,,,,,,,,,,,,,,,,,
ICE,MISC,ICEMisc,ICE,Ice sounds not fitting another category in this list.,"Block, Cap, Chill, Crystal, Cube, Floe, Formation, Freeze, Frigid, Frost, Frostbite, Frosty, Frozen, Glacier, Ice, Icicle, Icy, Miscellaneous, Shard, Sheet, Solid, Wintry",,,,,,,,,,,,,,,,,,,,,,,,,,,,,,,,,,,,,,,,,,,,,,,,,,,,,,,,,,,,
ICE,MOVEMENT,ICEMvmt,ICE,"Ice sliding or rattling, maybe an object sliding across ice. See also ICE-HANDLE.","Calve, Calving, Cube, Drag, Drift, Float, Floating, Floe, Flow, Glide, Ice, Icicle, Move, Pile, Rattle, Roll, Shake, Shear, Shearing, Skid, Slide, Slip, Slither",,,,,,,,,,,,,,,,,,,,,,,,,,,,,,,,,,,,,,,,,,,,,,,,,,,,,,,,,,,,
ICE,TONAL,ICETonl,ICE,"Tonal ice sounds, probably fairly rare, but that ice ping on a frozen lake would be one example.","Bowed, Cube, Frequency, Harmonic, Ice, Icicle, Melodic, Melodious, Musical, Ping, Pitch, Resonance, Resonant, Ring, Shing, Sonorous, Sound, Timbre, Tonal, Tone",,,,,,,,,,,,,,,,,,,,,,,,,,,,,,,,,,,,,,,,,,,,,,,,,,,,,,,,,,,,
LASERS,BEAM,LASRBeam,LASR,"Steady laser beams, not a laser gun. So a James Bond style laser, a scientific laser.","Beam, Blast, Bolt, Emission, Energy, Flash, Gamma, Glare, Gleam, Laser, Lidar, Light, Maser, Projection, Pulse, Radiation, Ray, Shine, Spark, Stream",,,,,,,,,,,,,,,,,,,,,,,,,,,,,,,,,,,,,,,,,,,,,,,,,,,,,,,,,,,,
LASERS,GUN,LASRGun,LASR,"Classic laser guns, blasters, laser cannons. That thing that Ben Burtt made famous.","Beam, Blaster, Cannon, Phaser, Plasma, Ray, Weapon",,,,,,,,,,,,,,,,,,,,,,,,,,,,,,,,,,,,,,,,,,,,,,,,,,,,,,,,,,,,
LASERS,IMPACT,LASRImpt,LASR,"Classic laser impact sounds, from blaster hits.","Beam, Blast, Blaster, Burst, Explode, Hit, Impact, Ray, Sizzle, Strike",,,,,,,,,,,,,,,,,,,,,,,,,,,,,,,,,,,,,,,,,,,,,,,,,,,,,,,,,,,,
LASERS,MISC,LASRMisc,LASR,Laser sounds not fitting another category in this list.,"Beam, Miscellaneous, Ray",,,,,,,,,,,,,,,,,,,,,,,,,,,,,,,,,,,,,,,,,,,,,,,,,,,,,,,,,,,,
LEATHER,CREAK,LETHRCreak,LETHR,"Leather creaks, jacket and bag creaks, saddle movements. Any creaking leather.","Cowhide, Creak, Deerskin, Groan, Hide, Nubuck, Pigskin, Saddle, Sheepskin, Squeak, Stress, Stretch, Suede, Tension",,,,,,,,,,,,,,,,,,,,,,,,,,,,,,,,,,,,,,,,,,,,,,,,,,,,,,,,,,,,
LEATHER,HANDLE,LETHRHndl,LETHR,"Leather handling, picking up a leather bag, putting on a leather jacket maybe. Some overlap with LEATHER-MOVEMENT possible.","Carry, Catch, Clasp, Clench, Clutch, Cowhide, Deerskin, Down, Embrace, Grab,  Grasp, Grip, Handle, Hide, Hold, Nubuck, Pickup, Pigskin, Seize, Set, Sheepskin, Suede, Take, Throw, Toss, Wield",,,,,,,,,,,,,,,,,,,,,,,,,,,,,,,,,,,,,,,,,,,,,,,,,,,,,,,,,,,,
LEATHER,IMPACT,LETHRImpt,LETHR,"Hits and impacts of leather, leather bag or saddle dropping.","Bang, Banging, Bump, Clap, Collide, Colliding, Cowhide, Crash, Crashing, Deerskin, Grab, Hide, Hit, Hitting, Impact, Impacting, Nubuck, Pigskin, Pound, Punch, Ram, Sheepskin, Slam, Slamming, Smack, Smacking, Strike, Striking, Suede, Thrust, Thud, Thump, Whack",,,,,,,,,,,,,,,,,,,,,,,,,,,,,,,,,,,,,,,,,,,,,,,,,,,,,,,,,,,,
LEATHER,MISC,LETHRMisc,LETHR,Leather sounds not fitting another category in this list.,"Animal, Cowhide, Deerskin, Goatskin, Hide, Lambskin, Leather, Miscellaneous, Nubuck, Pigskin, Rawhide, Sheepskin, Skin, Suede",,,,,,,,,,,,,,,,,,,,,,,,,,,,,,,,,,,,,,,,,,,,,,,,,,,,,,,,,,,,
LEATHER,MOVEMENT,LETHRMvmt,LETHR,"Movement of Leather, definitely overlap with LEATHER-CREAK and LEATHER-HANDLE.","Bend, Cowhide, Deerskin, Flap, Flex, Flop, Hide, Maneuver, Movement, Nubuck, Pigskin, Rotate, Rustle, Sheepskin, Slide, Stretch, Suede, Sway, Swing, Turn, Twist",,,,,,,,,,,,,,,,,,,,,,,,,,,,,,,,,,,,,,,,,,,,,,,,,,,,,,,,,,,,
LIQUID & MUD,BUBBLES,LIQBubl,LIQ,"Mud and thicker than water, thick bubbles, viscous liquid. Things like Oil, gloopy thick liquids.","Boiling, Bubble, Bubbles, Burbling, Carbonation, Cavitation, Effervesce, Effervescence, Effervescent, Fizz, Foam, Froth, Frothy, Lather, Mud, Pop, Sparkle, Suds",,,,,,,,,,,,,,,,,,,,,,,,,,,,,,,,,,,,,,,,,,,,,,,,,,,,,,,,,,,,
LIQUID & MUD,IMPACT,LIQImpt,LIQ,"Mud and thicker than water, Splats and hit. Things like Oil, gloopy thick liquids.","Hit, Impact, Kerplunk, Mud, Plop, Plunk, Slap, Slosh, Smack, Spatter, Splat, Splatter, Squelch, Squish",,,,,,,,,,,,,,,,,,,,,,,,,,,,,,,,,,,,,,,,,,,,,,,,,,,,,,,,,,,,
LIQUID & MUD,MISC,LIQMisc,LIQ,Mud and thicker than water sounds not fitting another category in this list.,"Caramel, Flow, Gel, Glue, Gravy, Honey, Miscellaneous, Movement, Oil, Paint, Resin, Slime, Sludge, Syrup, Tar, Viscosity",,,,,,,,,,,,,,,,,,,,,,,,,,,,,,,,,,,,,,,,,,,,,,,,,,,,,,,,,,,,
LIQUID & MUD,MOVEMENT,LIQMvmt,LIQ,"Mud and thicker than water, oozing, slime, glooping. Things like Oil, gloopy thick liquids.","Flooding, Goo, Gushing, Leak, Mud, Ooze, Rushing, Seep, Slime, Sloshing, Splashing, Surging, Swirling",,,,,,,,,,,,,,,,,,,,,,,,,,,,,,,,,,,,,,,,,,,,,,,,,,,,,,,,,,,,
LIQUID & MUD,SUCTION,LIQSuct,LIQ,"Thicker than water, disgusting liquidy suction, plunger sucks. Things like Oil, gloopy thick liquids.","Draw, Glomp, Mud, Plunger, Pull, Slurp, Suck, Suction, Vacuum",,,,,,,,,,,,,,,,,,,,,,,,,,,,,,,,,,,,,,,,,,,,,,,,,,,,,,,,,,,,
MACHINES,AMUSEMENT,MACHAmus,MACH,Theme park rides such as rollercoasters and carnival rides. Carnival game machines. General ambiences to go in AMBIENCE-AMUSEMENT.,"Apparatus, Bumper, Carousel, Carrousel, Cars, Coaster, Contraption, Device, Drop, Ferris, Flume, Freefall, Funhouse, Haunted, House, Kiddy, Line, Log, Machinery, Merry-Go-Round, Nickelodeon, Park, Pinball, Ride, Roller, Rollercoaster, Scrambler, Skeeball, Theme, Thrill, Tilt-A-Whirl, Tower, Waterslide, Wheel, Zip",,,,,,,,,,,,,,,,,,,,,,,,,,,,,,,,,,,,,,,,,,,,,,,,,,,,,,,,,,,,
MACHINES,ANTIQUE,MACHAntq,MACH,"Old mechanical sewing machines, ancient looms, olive presses, a bit ambiguous but a very old mechanical machine.","Abacus, Adding, Antique, Apparatus, Arcade, Automaton, Babbage, Butter, Cash, Churn, Classic, Contraption, Device, Edison, Enigma, Guttenberg, Hand-Cranked, Heritage, Historic, Linotype, Loom, Machine, Machinery, Mimeograph, Nostalgic, Old-Fashioned, Olive, Press, Printing, Register, Retro, Sewing, Vintage",,,,,,,,,,,,,,,,,,,,,,,,,,,,,,,,,,,,,,,,,,,,,,,,,,,,,,,,,,,,
MACHINES,APPLIANCE,MACHAppl,MACH,"General appliances, refrigerator, stove, oven, vacuum cleaner... AC and fans have their own category.","Air, Apparatus, Blender, Bread, Can, Cleaner, Coffee, Conditioner, Contraption, Cooker, Dehumidifier, Device, Dishwasher, Disposal, Dryer, Electric, Fan, Food, Fridge, Garbage, Griddle, Hair, Heater, Hot, Humidifier, Ice, Iron, Kettle, Machine, Machinery, Maker, Microwave, Mixer, Opener, Oven, Plate, Processor, Refrigerator, Rice, Sewing, Slow, Stand, Toaster, Vacuum, Waffle, Washing",,,,,,,,,,,,,,,,,,,,,,,,,,,,,,,,,,,,,,,,,,,,,,,,,,,,,,,,,,,,
MACHINES,CONSTRUCTION,MACHCnst,MACH,"A machine for construction that isn't a vehicle or a tool. For example a cement mixer, a woodchipper.","Apparatus, Cement, Chipper, Compactor, Concrete, Contraption, Crane, Device, Dozer, Driver, Generator, Jackhammer, Lift, Machinery, Mixer, Paver, Pile, Scissor, Steamroller, Trencher, Wood",,,,,,,,,,,,,,,,,,,,,,,,,,,,,,,,,,,,,,,,,,,,,,,,,,,,,,,,,,,,
MACHINES,ELEVATOR,MACHElev,MACH,Elevator movement and doors would go here.,"Apparatus, Contraption, Device, Dumbwaiter, Dumbwaiters, Freight, Hoist, Lift, Lifts, Machinery, Passenger, Paternoster, Platform, Service, Stair, Turbolift",,,,,,,,,,,,,,,,,,,,,,,,,,,,,,,,,,,,,,,,,,,,,,,,,,,,,,,,,,,,
MACHINES,ESCALATOR,MACHEscl,MACH,Escalators and moving walkways would go here.,"Apparatus, Contraption, Device, Machinery, Moving, Stairs, Travelator, Walkway, Walkways",,,,,,,,,,,,,,,,,,,,,,,,,,,,,,,,,,,,,,,,,,,,,,,,,,,,,,,,,,,,
MACHINES,FAN,MACHFan,MACH,"Fans of all types, box fans, ceiling fans. For air conditioning use MACHINES-HVAC.","Air, Apparatus, Bladeless, Blower, Box, Ceiling, Circulator, Contraption, Device, Exhaust, Industrial, Machinery, Ventilation",,,,,,,,,,,,,,,,,,,,,,,,,,,,,,,,,,,,,,,,,,,,,,,,,,,,,,,,,,,,
MACHINES,GARDEN,MACHGrdn,MACH,"Powered landscaping machines, lawnmowers, weed-whackers, edgers, hedge trimmers. See also TOOLS-GARDEN and OBJECTS-GARDEN.","Apparatus, Blower, Chainsaw, Contraption, Cultivator, Device, Eater, Edger, Hedge, Irrigation, Landscaping, Lawn, Lawnmower, Leaf, Machinery, Mower, Mulcher, Pole, Pressure, Saw, Tiller, Tillers, Trimmer, Washer, Weed, Whacker",,,,,,,,,,,,,,,,,,,,,,,,,,,,,,,,,,,,,,,,,,,,,,,,,,,,,,,,,,,,
MACHINES,GYM,MACHGym,MACH,"Exercise bikes, weight machines, treadmill, all things fitness. See also OBJECTS-GYM","Apparatus, Bike, Bowflex, Cardio, Climber, Contraption, Device, Elliptical, Exercise, Fitness, Machine, Machinery, Nautilus, Nordictrack, Resistance, Rower, Rowing, Stair, Stationary, Stepper, Trampoline, Treadmill, Weight, Workout",,,,,,,,,,,,,,,,,,,,,,,,,,,,,,,,,,,,,,,,,,,,,,,,,,,,,,,,,,,,
MACHINES,HITECH,MACHTech,MACH,"Think cool James Bond machines, big elaborate death traps, maybe Rube Goldberg type machines. See also SCIFI-MACHINE.","3D, 7, Apparatus, Arm, Bond, CNC, Contraption, Cutter, Device, Digital, Gadget, Handheld, Holographic, James, Laser, Machinery, Plasma, Printer, Quantum, Resin, Robotic, Spy",,,,,,,,,,,,,,,,,,,,,,,,,,,,,,,,,,,,,,,,,,,,,,,,,,,,,,,,,,,,
MACHINES,HVAC,MACHHvac,MACH,"Furnaces, Air Conditioners. Fans go in MACHINES-FAN. A close up gas furnace flame would go to FIRE-GAS.","Air, Aircon, Apparatus, Baseboard, Boiler, Chiller, Climate, Conditioner, Conditioning, Contraption, Control, Cooler, Dehumidifier, Device, Ductless, Evaporative, Filtration, Furnace, Handlers, Heat, Heater, Heating, Humidifier, Humidifiers, Machinery, Mini-Split, Pump, Pumps, Purifier, Radiator, Systems, Thermostat, Thermostats, Ventilation",,,,,,,,,,,,,,,,,,,,,,,,,,,,,,,,,,,,,,,,,,,,,,,,,,,,,,,,,,,,
MACHINES,INDUSTRIAL,MACHInd,MACH,"Big industrial presses, factory machines, industrial robots, any heavy manufacturing machines.","Apparatus, Assembly, Auto, Automation, Contraption, Conveyor, Cutting, Device, Die, Distillery, Duty, Factory, Form, Heavy, Hydraulic, Industrial, Injection, Line, Machine, Machinery, Manufacturing, Milling, Molding, Plant, Press, Printing, Production, Punch, Reactor, Robotics, Robots, Sawmill, Shearing, Smelter, Smeltery, Stamper, System",,,,,,,,,,,,,,,,,,,,,,,,,,,,,,,,,,,,,,,,,,,,,,,,,,,,,,,,,,,,
MACHINES,MECHANISM,MACHMech,MACH,"Complex mechanical smaller machines and gadgets, puzzle boxes that open portals to hell. Usually smaller devices.","7, Apparatus, Bond, Box, Contraption, Device, Gadget, Gizmo, Goldberg, James, Machinery, Puzzle, Rube, Spy",,,,,,,,,,,,,,,,,,,,,,,,,,,,,,,,,,,,,,,,,,,,,,,,,,,,,,,,,,,,
MACHINES,MEDICAL,MACHMed,MACH,"Machines typically found in a hospital, medical lab or Doctor's office.","Apparatus, Blood, Cat, Centrifuge, Concentrator, Contraption, CT, Defibrillator, Dental, Device, Dialysis, Drill, ECG, EKG, Glucometers, Heart, Infusion, Insulin, Lab, Life, Machine, Machinery, Machines, Monitor, MRI, Nebulizer, Oxygen, Pacemaker, Pet, Pressure, Pump, Pumps, Scan, Support, Test, Ultrasound, Ventilator, X-Ray",,,,,,,,,,,,,,,,,,,,,,,,,,,,,,,,,,,,,,,,,,,,,,,,,,,,,,,,,,,,
MACHINES,MISC,MACHMisc,MACH,Machine sounds not fitting another category in this list. See also MOTOR category.,"Apparatus, Contraption, Device, Machinery, Miscellaneous",,,,,,,,,,,,,,,,,,,,,,,,,,,,,,,,,,,,,,,,,,,,,,,,,,,,,,,,,,,,
MACHINES,OFFICE,MACHOffc,MACH,"Machines typically found in an office, such as printers and copy machines.","Apparatus, Binding, Business, Clock, Contraption, Copier, Copy, Cutter, Device, Dictaphone, Envelope, Facsimile, Fax, Inkjet, Interactive, Label, Laminator, Laser, Letter, Machine, Machinery, Maker, Mimeograph, Office, Opener, Paper, Photocopier, Plotter, Postal, Printer, Scale, Scanner, Shredder, Stenotype, Telefax, Time, Typewriter, Whiteboard, Xerox",,,,,,,,,,,,,,,,,,,,,,,,,,,,,,,,,,,,,,,,,,,,,,,,,,,,,,,,,,,,
