,UCS v8.2.1 Category List,,,,,,,,,,,,,,,,,,,,,,,,,,,,,,,,,,,,,,,,,,,,,,,,,,,,,,,,,,,,,,,,
"8.2.1 adds no new categories, but fixes one typo in the list for WOOD-HANDLE which should be WOODHndl.",,,,,,,,,,,,,,,,,,,,,,,,,,,,,,,,,,,,,,,,,,,,,,,,,,,,,,,,,,,,,,,,,
Category,SubCategory,CatID,CatShort,Explanations,Synonyms - Comma Separated,,,,,,,,,,,,,,,,,,,,,,,,,,,,,,,,,,,,,,,,,,,,,,,,,,,,,,,,,,,,
AIR,BLOW,AIRBlow,AIR,"Steady air blows, like from a compressed can of air.","Aerate, Aerosol, Air, Airhose, Balloon, Beat, Bellows, Blast, Blow, Blower, Blowgun, Blown, Blowpipe, Blows, Blowtube, Bluff, Carbon, CO2, Compressed, Depressurize, Dioxide, Duster, Exhaust, Flutter, Gust, Helium, Huff, Inflate, Nitrogen, Oxygen, Puff, Puffed, Purge, Release, Sputter, Vent, Waft, Whiff",,,,,,,,,,,,,,,,,,,,,,,,,,,,,,,,,,,,,,,,,,,,,,,,,,,,,,,,,,,,
AIR,BURST,AIRBrst,AIR,"Sharp air releases, pressure releases, a tennis ball can popping open, a fire extinguisher","Air, Airbed, Airblast, Airgun, Airhose, Blast, Blowhole, Blowout, Burst, Carbon, Chuff, CO2, Dioxide, Discharge, Explosion, Flash, Gas, Helium, Jet, Kerboom, Nitrogen, Outburst, Oxygen, Poof, Pop, Rush, Seal, Spurt, Surge, Torrent",,,,,,,,,,,,,,,,,,,,,,,,,,,,,,,,,,,,,,,,,,,,,,,,,,,,,,,,,,,,
AIR,HISS,AIRHiss,AIR,"Slow air releases, a flat tire, leak in an air pipe.","Carbon, CO2, Dioxide, Discharge, Exhaust, Expel, Helium, Hissing, Leak, Nitrogen, Oxygen, Purr, Release, Shush, Sibilate, Whistling",,,,,,,,,,,,,,,,,,,,,,,,,,,,,,,,,,,,,,,,,,,,,,,,,,,,,,,,,,,,
AIR,MISC,AIRMisc,AIR,Air sounds not fitting another category in this list.,"Airtight, Airway, Carbon, CO2, Dioxide, Gas, Helium, Inflatable, Intake, Miscellaneous, Nitrogen, Oxygen, Sky, Ventilation",,,,,,,,,,,,,,,,,,,,,,,,,,,,,,,,,,,,,,,,,,,,,,,,,,,,,,,,,,,,
AIR,SUCTION,AIRSuck,AIR,"Air being sucked in, a vacuum sucking in air, the rush of air in a shopvac.","Air, Aspirate, Aspiration, Carbon, CO2, Consume, Dental, Dioxide, Draw, Helium, Hoover, Ingest, Inspiration, Inspire, Intake, Nitrogen, Oxygen, Pull, Pump, Pumps, Siphon, Suck, Suction, Syphon, Syringe, Vac, Vacuity, Vacuum",,,,,,,,,,,,,,,,,,,,,,,,,,,,,,,,,,,,,,,,,,,,,,,,,,,,,,,,,,,,
AIRCRAFT,DOOR,AERODoor,AERO,"Aircraft doors, some possible overlap with other DOOR categories, or VEHICLES-DOOR.","Airplane, Aviation, Boarding, Cabin, Cargo, Cockpit, Emergency, Entrance, Entryway, Exit, Fuselage, Hatch, Helicopter, Jet, Panel, Passenger, Ports, Trapdoor, Wing",,,,,,,,,,,,,,,,,,,,,,,,,,,,,,,,,,,,,,,,,,,,,,,,,,,,,,,,,,,,
AIRCRAFT,HELICOPTER,AEROHeli,AERO,"For all manner of helicopters, gyrocopters.","Aerochopper, Aircraft, Apache, Autogiro, Autogyro, Bird, Blackhawk, Chopper, Choppers, Copter, Copters, Ghetto, Gyrocopter, Gyroplane, Heli, Helichopper, Helicopter, Helicopteron, Helicoptor, Helijet, Helipad, Helipilot, Heliport, Helo, Helos, Huey, Jetcopter, Lift, Medevac, Medivac, Multirotor, Ornithopter, Police, Rotary-Wing, Rotodyne, Rotorcraft, Sar, Sikorsky, Skyhook, Tailwheel, Tiltrotor, Tricopter, Vertical, VTOL, Whirlybird",,,,,,,,,,,,,,,,,,,,,,,,,,,,,,,,,,,,,,,,,,,,,,,,,,,,,,,,,,,,
AIRCRAFT,INTERIOR,AEROInt,AERO,"Interior recordings (mainly complex ambiences) of aircraft, from cockpit interiors, to passenger jet interiors.","737, 747, 777, A310, A330, A350, A380, Aboard, Aeroplane, Airbus, Aircraft, Airliner, Airplane, Aisle, Avionics, Bay, Belly, Bins, Boeing, Bombardier, Bowels, Cabin, Cargo, Cockpit, Compartment, Crew, DC-10, Deck, Fighter, Flight, Fuselage, Galley, Glider, Hold, Inside, Interior, Jet, Jetliner, Jumbo, Lavatory, Learjet, Midflight, Flight, Overhead, Passenger, Zeppelin",,,,,,,,,,,,,,,,,,,,,,,,,,,,,,,,,,,,,,,,,,,,,,,,,,,,,,,,,,,,
AIRCRAFT,JET,AEROJet,AERO,"All commercial and private jet powered aircraft, military jets would go under AIRCRAFT-MILITARY.","737, 747, 777, A310, A330, A350, A380, Aeroplane, Afterburner, Airbus, Aircraft, Airliner, Airplane, Boeing, Bombardier, Cargo, Commercial, DC-10, Jet, Jetliner, Jumbo, Learjet, Passenger, Plane, Private, Ramjet, Regional, Scramjet, Supersonic, Turbojet, Twinjet, Unducted",,,,,,,,,,,,,,,,,,,,,,,,,,,,,,,,,,,,,,,,,,,,,,,,,,,,,,,,,,,,
AIRCRAFT,MECHANISM,AEROMech,AERO,"Mechanical components of aircraft, for example landing gear, or levers and switches.","Actuators, Aerofoil, Aeroplane, Aileron, Ailerons, Airbrake, Aircraft, Airplane, Apron, Arrester, Autopilot, Avionics, Bombsight, Brakes, Cockpit, Column, Control, Cowl, Cowling, Devices, Doors, Elevator, Elevators, Fin, Flap, Flaps, Flight, Gear, Gimbals, Gyroscope, Hook, Hydraulic, Instrument, Landing, Lever, Pedal, Propellers, Reversers, Rudder, Slats, Spoilers, Surfaces, Systems, Throttle, Thrust, Turbines, Yoke",,,,,,,,,,,,,,,,,,,,,,,,,,,,,,,,,,,,,,,,,,,,,,,,,,,,,,,,,,,,
AIRCRAFT,MILITARY,AEROMil,AERO,"Military aircraft, military fighter jets, stealth bombers, but any military aircraft goes here. Also military drones. Military helicopters could go here or in AIRCRAFT-HELICOPTER.","A10, Aeroplane, Air, Aircraft, Airplane, Angels, Army, Attack, Blue, Bogey, Bomber, Combat, Drone, F16, F18, F22, F35, Fighter, Force, Gunship, Interceptor, Jet, Lockheed, Mig, Military, Mustang, Navy, P51, P52, Plane, Reconnaissance, Sortie, Spy, Squadron, Stealth, Strike, Surveillance, Thunderbirds, Trainer, Transport, Warbird, Warplane",,,,,,,,,,,,,,,,,,,,,,,,,,,,,,,,,,,,,,,,,,,,,,,,,,,,,,,,,,,,
AIRCRAFT,MISC,AEROMisc,AERO,Aircraft not fitting another category in this list.,"Aeroplane, Air, Aircraft, Airplane, Balloon, Blimp, Dirigible, Flyer, Flyover, Glider, Hang, Hang-Glider, Hot, Land, Liftoff, Parachute, Piloting, Runway, Ultralight, Zeppelin",,,,,,,,,,,,,,,,,,,,,,,,,,,,,,,,,,,,,,,,,,,,,,,,,,,,,,,,,,,,
AIRCRAFT,PROP,AEROProp,AERO,Aircraft using props as means of propulsion. A propeller airplane.,"Aeroplane, Aircraft, Airplane, Airscrew, Amphibious, Antique, Beechcraft, Biplane, Bombardier, Bushplane, Cesna, Cherokee, Crop, Cub, Duster, Floatplane, Piper, Plane, Prop, Propeller, Propjet, Seaplane, STOL, Stunt, Triplane, Turboprop, Twin-Prop, Vintage",,,,,,,,,,,,,,,,,,,,,,,,,,,,,,,,,,,,,,,,,,,,,,,,,,,,,,,,,,,,
AIRCRAFT,RADIO CONTROLLED,AERORadio,AERO,"Toy hobby radio controlled, UAV, quadcopters, RC jets and RC helicopters.","Aerial, Airplane, Control, Controlled, Drone, Helicopter, Jet, Model, Quadcopters, Radio, RC, Remote, RPA, RPV, Scale, UAS, UAV, Unmanned",,,,,,,,,,,,,,,,,,,,,,,,,,,,,,,,,,,,,,,,,,,,,,,,,,,,,,,,,,,,
AIRCRAFT,ROCKET,AERORckt,AERO,"Jet powered rockets and rocket engines., missiles.","Blastoff, Booster, Hypersonic, ICBM, Jet, Jetpack, Launch, Launchers, Launching, Launchpad, Missile, Missiles, Missle, NASA, Nuclear, Nuke, Orbit, Payload, Propellant, Propelled, Propellent, Ramjet, Ramjets, Retrorocket, Retrorockets, Rocketeer, Rocketeers, Rocketman, Rocketplane, Rocketry, Rocketship, Shuttle, Skyrocket, Soyuz, Space, Spacelab, Spaceman, Spaceplane, Spaceplanes, Spacex, Sputniks, Suborbital, Thruster, Warhead",,,,,,,,,,,,,,,,,,,,,,,,,,,,,,,,,,,,,,,,,,,,,,,,,,,,,,,,,,,,
ALARMS,BELL,ALRMBell,ALRM,"All alarms which use bells, a school bell, fire alarm bell, a railroad crossing bell.","Alarms, Alert, Bank, Burglar, Caution, Clanger, Clock, Crossing, Fire, Notice, Railroad, Reminder, School, Signal, Striker, Tower, Warning",,,,,,,,,,,,,,,,,,,,,,,,,,,,,,,,,,,,,,,,,,,,,,,,,,,,,,,,,,,,
ALARMS,BUZZER,ALRMBuzr,ALRM,"All alarms using buzzers, or buzzers in general even if not technically an alarm, would probably go here. A front door buzzer.","Alarm, Alarms, Alert, Burglar, Buzzing, Caution, Door, Doorkeeper, Doorman, Emergency, Entry, Fire, Front, Game, Home, Hospital, Intercom, Notice, Reminder, Security, Show, Signal, Warning",,,,,,,,,,,,,,,,,,,,,,,,,,,,,,,,,,,,,,,,,,,,,,,,,,,,,,,,,,,,
ALARMS,CLOCK,ALRMClok,ALRM,"Specifically alarm clocks, digital or analog. A bit of overlap with ALARMS-BELL, but clock alarms of all kinds probably best to go here.","Alarm, Alarms, Analog, Clock, Digital, Sleep, Snooze, Timepiece, Timer, Wind",,,,,,,,,,,,,,,,,,,,,,,,,,,,,,,,,,,,,,,,,,,,,,,,,,,,,,,,,,,,
ALARMS,ELECTRONIC,ALRMElec,ALRM,"All electronic alarms, pure electronic tone alarms. Home burglar alarms, smoke detectors, etc. Car alarms would go to VEHICLES-ALARMS.","Alarms, Alert, Button, Car, Carbon, Caution, CO2, Detector, Digital, Home, Intruder, Intrusion, Keycard, Monoxide, Notice, Panic, Programable, Reminder, Security, Signal, Smoke, Timer, Warning",,,,,,,,,,,,,,,,,,,,,,,,,,,,,,,,,,,,,,,,,,,,,,,,,,,,,,,,,,,,
ALARMS,MISC,ALRMMisc,ALRM,Alarm sounds not fitting another category in this list.,"Alarms, Alert, Anti-Theft, Caution, Homing, Miscellaneous, Notice, Reminder, Signal, Warning",,,,,,,,,,,,,,,,,,,,,,,,,,,,,,,,,,,,,,,,,,,,,,,,,,,,,,,,,,,,
ALARMS,SIREN,ALRMSirn,ALRM,"Mechanical sirens, like old klaxons. Vehicle sirens such a police, fire and ambulance to go to VEHICLES-SIREN.","Ahooga, Air, Air-Raid, Alarms, Blare, Civil, Claxon, Defense, Doppler, Hailer, Hooters, Horn, Klaxon, Raid, Siren, Sirenidae, Tornado",,,,,,,,,,,,,,,,,,,,,,,,,,,,,,,,,,,,,,,,,,,,,,,,,,,,,,,,,,,,
AMBIENCE,AIR,AMBAir,AMB,"Quiet exterior 'air' with little activity, like exterior room tones, very simple exterior ambiences. The exterior equivalent of a room tone. If noticable activity find a better fitting category.","Atmos, Atmosphere, Ambience, Ambiance, BG, Background, Calm, Cave, Clear, Clearing, Desert, Field, Forest, Garden, Mountain, Night, Noiselessly, Oasis, Peaceful, Quiet, Sedate, Serene, Silence, Silent, Snowy, Still, Tranquil, Winter",,,,,,,,,,,,,,,,,,,,,,,,,,,,,,,,,,,,,,,,,,,,,,,,,,,,,,,,,,,,
AMBIENCE,ALPINE,AMBAlpn,AMB,"Mountain ambiences, for recordings and ambiences geographically linked to Alpine Environments. Some overlap with AMBIENCE-RURAL.","Alpen, Alpes, Alpin, Alpine, Alpinist, Alpinists, Alps, Andean, Andes, Atmos, Atmosphere, Ambience, Ambiance, BG, Background, Craggy, Downhill, Glacial, Highland, Hilly, Himalayas, Icefalls, Jagged, Matterhorn, Meadow, Montane, Montanic, Mountain, Mountaineer, Mountaineering, Mountainous, Mountains, Mountainscape, Mountainside, Mountaintop, Nordic, Pass, Patagonian, Peak, Peaks, Pyrenean, Pyrenees, Resort, Ridge, Rockies, Rocky, Rugged, Ski, Snowcapped, Snowy, Styrian, Subalpine, Summit, Tetons, Timberline, Tirol, Transalpine, Transmontane, Tyrol, Tyrolean, Ultramontane, Upland, Uplandish, Uralian",,,,,,,,,,,,,,,,,,,,,,,,,,,,,,,,,,,,,,,,,,,,,,,,,,,,,,,,,,,,
AMBIENCE,AMUSEMENT,AMBAmus,AMB,"Theme parks and carnivals. Beware of possible rights issues with uncleared music. Carnivals, fairs, festivals. Probably arcades too.","Atmos, Atmosphere, Ambience, Ambiance, BG, Background, Adventure, Arcade, Biopark, Boardwalk, Bouncing, Bumper, Carnival, Carousel, Cars, Casino, Circus, Coaster, County, Course, Disney, Disneyland, Exploratorium, Fair, Fairground, Ferris, Festival, Flags, Funfair, Funhouse, Gamepark, Go-Kart, Golf, Haunted, Hellhouse, House, Merry-Go-Round, Midway, Mini, Mini-Golf, Park, Pinball, Playland, Roller, Six, Six-Flags, Theater, Theme, Tourist, Traveling, Venue, Wally, Water, Waterpark, Wheel, Wonderworld, Zoological",,,,,,,,,,,,,,,,,,,,,,,,,,,,,,,,,,,,,,,,,,,,,,,,,,,,,,,,,,,,
AMBIENCE,BIRDSONG,AMBBird,AMB,"Group songbirds, like a dawn chorus of pretty birds, where the birds are the prominent sound. Single birds would go in BIRDS-SONGBIRD.","Atmos, Atmosphere, Ambience, Ambiance, BG, Background, Bird, Birdcall, Birdcalls, Birdlife, Birdsong, Birdsongs, Cacophony, Cheeping, Chirping, Chirpings, Chirps, Chittering, Chorus, Dawn, Flocks, Morning, Nightbirds, Nightingales, Peeping, Pinewoods, Pretty, Singing, Songbird, Songbirds, Songful, Soundscape, Sparrows, Spring, Susurration, Susurrus, Thrum, Trilling, Tweeting, Twittering, Twitterings, Vocalisations, Warble, Warbling, Warblings, Whistlings",,,,,,,,,,,,,,,,,,,,,,,,,,,,,,,,,,,,,,,,,,,,,,,,,,,,,,,,,,,,
AMBIENCE,CELEBRATION,AMBCele,AMB,"Parties, New Years Eve. Not pure crowds, as that would go in CROWDS, but i.e. exterior city new years. Also see AMBIENCES-AMUSEMENT for something like a fair or festival.","Anniversary, Atmos, Atmosphere, Ambience, Ambiance, BG, Background, Awards, Birthday, Birthdays, Blast, Blowout, Carnival, Celebrants, Ceremonials, Ceremonies, Ceremony, Championships, Commemorate, Commemorating, Commemoration, Commemorations, Commemorative, Concelebrate, Congratulating, Decorations, Drunken, Eid, Elation, Enjoyments, Entertainments, Event, Excitement, Excitements, Exhilaration, Extravaganza, Extravaganzas, Exultation, Exulting, Fairs, Feasts, Felicitating, Felicities, Fest, Festival, Festivals, Festiveness, Festivities, Festivity, Fete, Fiesta, Fireworks, Functions, Gala, Galas, Gathering, Gatherings, Graduation, Graduations, Happiness, Joyous, Joyousness, Jubilance, Jubilating, Jubilation, Jubilee, Merriment, Merrymaking, Observance, Observances, Occasion, Occasions, Overjoyed, Parade, Parades, Parties, Party, Partygoers, Partying, Prom, Public, Qing, Quincea‚àö¬±era, Rager, Rave, Reception, Religious, Revellers, Revelling, Revelries, Revelry, Traditional, Traditions, Victories, Wedding, Weddings",,,,,,,,,,,,,,,,,,,,,,,,,,,,,,,,,,,,,,,,,,,,,,,,,,,,,,,,,,,,
AMBIENCE,CONSTRUCTION,AMBCnst,AMB,"Construction scenes with things like jackhammers, cranes, pile drivers, composite construction scene, road construction also.","Architect, Architectural, Architecture, Assembly, Atmos, Atmosphere, Ambience, Ambiance, BG, Background, Build, Builder, Building, Buildings, Buildup, Built, Carpentry, Construct, Constructing, Constructive, Constructor, Contracting, Contractor, Demolition, Design, Engineering, Erect, Erection, Foundation, Home, Housing, Infrastructure, Installation, Labour, Manufacture, Planning, Plot, Prefab, Preparation, Project, Projects, Provision, Rebuild, Rebuilding, Reconstruct, Reconstruction, Remodel, Reno, Renovation, Repair, Road, Site, Workmanship, Works, Worksite",,,,,,,,,,,,,,,,,,,,,,,,,,,,,,,,,,,,,,,,,,,,,,,,,,,,,,,,,,,,
AMBIENCE,DESERT,AMBDsrt,AMB,Quiet desert ambiences with appropriate insects and birds. Maybe tumbleweeds.,"Abandon, Arabian, Arid, Aridity, Aridness, Atacama, Atmos, Atmosphere, Ambience, Ambiance, BG, Background, Badland, Badlands, Bare, Barren, Bedouin, Bedouins, Cacti, Cactuses, Canyons, Dearth, Desertlike, Desolate, Dry, Dune, Dunes, Dustbowl, Empty, Expanse, Flatlands, Forsake, Gobi, Godforsaken, Grassless, Hilltop, Hot, Hyperarid, Infertile, Inhospitable, Kalahari, Karakum, Lifeless, Lonely, Mirage, Mirages, Mohave, Mojave, Moonscape, Oases, Oasis, Outback, Parched, Playa, Sable, Sagebrush, Sahara, Saharan, Saharawi, Sahraoui, Sahrawi, Sand, Sandstorms, Sandy, Scrublands, Semidesert, Sonoran, Steppes, Sunbaked, Tumbleweed, Wadi, Wadis, Walkabout, Waste, Wasteland, Wastelands, Waterless",,,,,,,,,,,,,,,,,,,,,,,,,,,,,,,,,,,,,,,,,,,,,,,,,,,,,,,,,,,,
AMBIENCE,DESIGNED,AMBDsgn,AMB,Artificial designed ambience. V8.2 adds AMBIENCE-FANTASY and AMBIENCE-SCIFI which may be better fit for most 'designed' categories.,"Artificial, Atmos, Atmosphere, Ambience, Ambiance, BG, Background, Constructed, Created, Manufactured",,,,,,,,,,,,,,,,,,,,,,,,,,,,,,,,,,,,,,,,,,,,,,,,,,,,,,,,,,,,
AMBIENCE,EMERGENCY,AMBEmrg,AMB,"Crime scenes, firefighting scenes, accident scenes, with things like firefighters, police, ambulances and medics. Also see VEHICLES-EMERGENCY.","Accident, Assistance, Atmos, Atmosphere, Ambience, Ambiance, BG, Background, Burglary, Calamity, Casualty, Catastrophe, Crime, Crises, Crisis, Danger, Disaster, Disasters, Evac, Evacuation, Evacuations, Evidence, Fighting, Fire, Hazard, Hazardous, Help, Incident, Injury, Lifesaving, Mass, Medevac, Medical, Medics, Murder, Natural, Paramedics, Pileup, Plight, Police, Rescue, Resuscitation, Resuscitative, Robbery, Scene, Search, Shooting, SOS, Succor, Triage, Urgence, Urgency, Urgent, Urgently",,,,,,,,,,,,,,,,,,,,,,,,,,,,,,,,,,,,,,,,,,,,,,,,,,,,,,,,,,,,
AMBIENCE,FANTASY,AMBFant,AMB,"Magical or other wordly composite ambiences, soundscapes, think Middle Earth or Pandora.","Adventure, Arthurian, Atmos, Atmosphere, Ambience, Ambiance, BG, Background, Castle, Costume, Dream, Dreaming, Dreamland, Dreamlands, Dreamlike, Dreams, Dreamscape, Dreamworld, Dwarven, Earth, Elven, Enchanted, Fairy, Fairyland, Fairytale, Fairytales, Fantasia, Fantasist, Fantasizing, Fantastic, Fantasyland, Fictional, Figment, Forest, Hallucination, Illusory, Imaginary, Imagination, Imaginative, Imaginings, Imitation, Kingdom, Lair, Magical, Middle, Mine, Mirage, Mystical, Mythical, Mythological, Mythology, Mythopoeic, Pandora, Phantasie, Phantasmagorical, Phantasy, Realm, Roleplaying, Surrealism, Surrealist, Surrealistic, Tower, Unreal, Unrealism, Unreality, Utopia, Utopian, Utopianism, Village, Visionary, Whimsical, Wizard",,,,,,,,,,,,,,,,,,,,,,,,,,,,,,,,,,,,,,,,,,,,,,,,,,,,,,,,,,,,
AMBIENCE,FARM,AMBFarm,AMB,"Specifically farm ambiences, with animals, maybe tractors working, chickens, etc. Isolated farm animals would go into ANIMALS-FARM.","Agrarian, Agricultural, Agriculture, Agro, Agronomic, Atmos, Atmosphere, Ambience, Ambiance, BG, Background, Aquaculture, Arable, Barn, Breeding, Cattle, Chickens, Corn, Corral, Cow, Crops, Cultivar, Cultivate, Cultivation, Cultured, Dairy, Farmer, Farmland, Farmstead, Goat, Grain, Grange, Grow, Grower, Harvest, Harvesting, Hatchery, Herding, Homestead, Husbandry, Land, Manufacturer, Nurture, Operation, Operational, Orchard, Pastoral, Pasture, Peasant, Pen, Pharm, Pig, Plantation, Planting, Poultry, Produce, Producer, Raise, Ranch, Rancher, Ranching, Rangeland, Rearing, Rural, Sheep, Silo, Stockbreeding, Stocking, Stud, Tillage, Tilling, Tractor, Vineyard",,,,,,,,,,,,,,,,,,,,,,,,,,,,,,,,,,,,,,,,,,,,,,,,,,,,,,,,,,,,
AMBIENCE,FOREST,AMBForst,AMB,"Forest recordings or forest composite files. Trees and birds, maybe wind in trees all together. Some overlap with AMBIENCE-RURAL or AMBIENCE-ALPINE.","Alder, Apple, Ash, Atmos, Atmosphere, Ambience, Ambiance, BG, Background, Aspen, Beech, Birch, Boreal, Boxwood, Buckeye, Cedar, Cherry, Chestnut, Conifer, Coniferous, Coppice, Coppices, Copse, Copses, Cypress, Deciduous, Deforestation, Dogwood, Elm, Fir, Forester, Foresters, Forestier, Forestland, Forestlands, Forestry, Foresty, Forrest, Forrests, Greenwood, Grove, Hemlock, Hickory, Larch, Lumbering, Magnolia, Mahogany, Maple, Oak, Old-Growth, Pine, Pines, Plantation, Poplar, Primeval, Rainforest, Rainforests, Redwood, Reforesting, Reliant, Reserve, Sequoia, Spruce, Stands, Stumpage, Sycamore, Taiga, Temperate, Thicket, Timber, Timberland, Tree, Trees, Treetop, Tress, Underbrush, Undergrowth, Understory, Unforested, Vegetation, Weald, Wilderness, Wildfires, Wildland, Wildwood, Willow, Wooded, Woodland, Woodlands, Woodlot, Woods, Woody, Yew",,,,,,,,,,,,,,,,,,,,,,,,,,,,,,,,,,,,,,,,,,,,,,,,,,,,,,,,,,,,
AMBIENCE,GRASSLAND,AMBGras,AMB,"Prairies, meadows, grazing patures, etc. But FARMS has own category if farm animals or human activity are present.","Atmos, Atmosphere, Ambience, Ambiance, BG, Background, Cropland, Croplands, Farmland, Field, Floodplain, Grass, Grasses, Grassy, Grazing, Habitat, Habitats, Lowland, Meadow, Meadowland, Meadows, Moorland, Overgrazed, Pasture, Pastureland, Pastures, Plain, Plains, Prairie, Prairies, Range, Rangeland, Rangelands, Sagebrush, Savanna, Savannah, Scrublands, Semiarid, Semidesert, Seminatural, Shortgrass, Shrubland, Shrublands, Steppe, Subalpine, Tallgrass, Tussock, Unforested, Ungrazed, Uplands, Vegetational",,,,,,,,,,,,,,,,,,,,,,,,,,,,,,,,,,,,,,,,,,,,,,,,,,,,,,,,,,,,
AMBIENCE,HISTORICAL,AMBHist,AMB,"Old West scenes, Roman street scenes. Composite history and ancient ambiences.","Ancestral, Ancient, Anthropological, Antique, Archaeologic, Archaeological, Archeological, Atmos, Atmosphere, Ambience, Ambiance, BG, Background, Biblical, Biographical, Castle, Chronological, Chronology, City, Classic, Earlier, Epoch, Epochal, Factual, Folkloric, Former, Geographic, Geographical, Geological, Geopolitical, Ghost, Gold, Greece, Groundbreaking, Heritage, Historian, Historically, Histories, Historiographic, Historiographical, Historique, History, Landmark, Legendary, Literary, Longstanding, Medieval, Monument, Monumental, Monuments, Old, Olden, Origin, Palace, Past, Pedigree, Philosophical, Prehistoric, Prehistorical, Previous, Prior, Pseudohistorical, Pyramid, Real, Retrospective, Rome, Ruin, Rush, Site, Story, Tale, Timeline, Town, Traditional, Village, Vintage, West",,,,,,,,,,,,,,,,,,,,,,,,,,,,,,,,,,,,,,,,,,,,,,,,,,,,,,,,,,,,
AMBIENCE,HITECH,AMBTech,AMB,"Hi-tech machine rooms. Data centers, control rooms. James Bond type lairs. Spaceship interiors.","007, Advanced, Artificial, Atmos, Atmosphere, Ambience, Ambiance, BG, Background, Biotechnology, Bond, Center, Control, Cutting-Edge, Cyber, Cyberactive, Cybercentric, Cybercriminal, Cybererotic, Cybergenic, Cyberliterate, Cyberoptimistic, Cyberphysical, Cyberpunky, Cyberqueer, Cyberreal, Cybersavvy, Cybersexy, Data, Digital, Futuristic, High-Tech, Innovative, Intelligence, Intercomputer, Internet, Internetlike, Internetted, James, Lab, Laboratory, Machine, Modern, Multiserver, Multisite, Multiuser, Multiworkstation, Nanotechnology, Online, Research, Robotics, Room, Scientist, Server, Sophisticated, Spy, Technical, Techno, Technological, Technology, Virtual",,,,,,,,,,,,,,,,,,,,,,,,,,,,,,,,,,,,,,,,,,,,,,,,,,,,,,,,,,,,
AMBIENCE,HOSPITAL,AMBHosp,AMB,"Hospital ambiences of all kinds, surgery and emergency rooms too. Possibly veterinarian hospitals too.","Admission, Ambulances, Ambulatory, Atmos, Atmosphere, Ambience, Ambiance, BG, Background, Beds, Bellevue, Care, Clinic, Clinica, Clinical, Convalesces, Department, Doctor, Doctors, Emergency, Gynecology, Healthcare, Hosp, Hospice, Hospitalier, Hospitalist, Hospitality, Hospitalization, Hospitalizations, Hospitalized, House, ICU, Infirmaries, Infirmary, Inpatient, Inpatients, Intensive, Laboratory, Maternity, Medevac, Medic, Medical, Mental, Morgue, Mortuary, Neonatal, Nurse, Nurses, Obstetrics, Occupational, Oncology, Operating, Outpatient, Outpatients, Patient, Pediatrics, Pharmacy, Physical, Physician, Radiology, Recuperating, Room, Sanatorium, Sanitarium, Sick, Sickbay, Sickhouse, Surgery, Therapy, Treatment, Unit, Waiting, Ward",,,,,,,,,,,,,,,,,,,,,,,,,,,,,,,,,,,,,,,,,,,,,,,,,,,,,,,,,,,,
AMBIENCE,INDUSTRIAL,AMBInd,AMB,"Industrial warehouses and factories, plants or any ambience with an industrial feeling.","Aerospace, Assembly, Atmos, Atmosphere, Ambience, Ambiance, BG, Background, Automotive, Biomedical, Biotechnical, Chemical, Construction, Engineering, Fabrication, Facility, Factories, Factory, Foundry, Heavy, Industrial, Industrialism, Industrialists, Industrialization, Industrialized, Industrializing, Industries, Industry, Institutional, Intellectual, Labour, Line, Machinery, Manufacturing, Mercantile, Metallurgic, Mill, Mining, Park, Petrochem, Petrochemical, Pharmaceutical, Plant, Postindustrial, Power, Press, Printing, Processing, Production, Recycling, Refinery, Sector, Sectoral, Sectors, Site, Steel, Technical, Textile, Warehouse, Worker, Workers, Working, Workshop",,,,,,,,,,,,,,,,,,,,,,,,,,,,,,,,,,,,,,,,,,,,,,,,,,,,,,,,,,,,
AMBIENCE,INSECT,AMBInsc,AMB,"Thick ambiences of insects, cicada and cricket beds mainly. May contain over sounds but main sound being large presence of insects. See also ANIMALS-INSECT for more isolated sounds.","Atmos, Atmosphere, Ambience, Ambiance, BG, Background, Bee, Beehive, Beekeeper, Bug, Chirpy, Cicadas, Cocoon, Crickets, Flies, Fly, Katydids, Locusts, Mosquito, Nest, Nested, Nesting, Pest, Pesticide, Pheromone, Swarm, Wasp",,,,,,,,,,,,,,,,,,,,,,,,,,,,,,,,,,,,,,,,,,,,,,,,,,,,,,,,,,,,
AMBIENCE,LAKESIDE,AMBLake,AMB,"Ambiences relating to lakes, not isolated lapping, but the lake version of AMBIENCE-SEASIDE. See also WATER-LAPPING.","Atmos, Atmosphere, Ambience, Ambiance, BG, Background, Beach, Beachside, Boathouse, Boathouses, Creekside, Dock, Dockside, Fishing, Frontage, Lakefront, Lakehead, Lakes, Lakescape, Lakeshore, Lakeshores, Lakeview, Lakewater, Lapping, Loch, Lochside, Pond, Pondside, Quayside, Reservoir, Riverbank, Riverfront, Riverside, Shore, Shorefront, Shoreland, Shores, Swimming, Waterfront",,,,,,,,,,,,,,,,,,,,,,,,,,,,,,,,,,,,,,,,,,,,,,,,,,,,,,,,,,,,
AMBIENCE,MARKET,AMBMrkt,AMB,"Busy exterior or interior market activity and crowds. Think vibrant international markets in Istanbul or Africa, but any market.","Antique, Art, Atmos, Atmosphere, Ambience, Ambiance, BG, Background, Bargain, Bazaar, Bazar, Buy, Buying, Christmas, Commerce, Community, Craft, District, Exchange, Farmers, Fish, Flea, Food, Garage, Grocery, Hawker, Machado, Market, Marketplace, Mart, Mercado, Mercato, Merchandising, Merchant, Merchantable, Merchants, Night, Organic, Public, Purchasing, Sale, Sell, Selling, Shopping, Square, Street, Trade, Trading, Vendor, World",,,,,,,,,,,,,,,,,,,,,,,,,,,,,,,,,,,,,,,,,,,,,,,,,,,,,,,,,,,,
AMBIENCE,MISC,AMBMisc,AMB,Ambience sounds not fitting another category in this list.,"Ambiance, Atmospheres, Atmospherical, Atmospherics, Miscellaneous, Surroundings",,,,,,,,,,,,,,,,,,,,,,,,,,,,,,,,,,,,,,,,,,,,,,,,,,,,,,,,,,,,
AMBIENCE,NAUTICAL,AMBNaut,AMB,"Relating to ships at sea, shipyards, things revolving around ships. (compare to AMBIENCE-SEASIDE). Water only recordings would go to a WATER category.","Aft, Anchorage, Atmos, Atmosphere, Ambience, Ambiance, BG, Background, Barnacled, Beachy, Boat, Boating, Boaty, Bow, Buccaneer, Buoy, Buoyage, Deck, Dock, Docks, Harbor, Jetty, Landlubber, Landlubbers, Mapping, Marina, Marine, Mariner, Mariners, Maritime, Mercantile, Midship, Naut, Nautic, Nautique, Naval, Navicular, Navies, Navigable, Navigational, Oceangoing, Oceanic, Oceanographic, Oceanographical, Offshore, Paddling, Pier, Piratic, Piratical, Port, Preppy, Sailor, Sailorly, Sailors, Sailworthy, Seaborne, Seafarer, Seafarers, Seafaring, Seagoing, Seakindly, Seamanlike, Seamanship, Seaward, Seaworthy, Semiseafaring, Ship, Shipboard, Shipbuilding, Shiplike, Shiply, Shipworks, Shipyard, Stern, Waterborne, Wharf, Yacht, Yachting, Yachty",,,,,,,,,,,,,,,,,,,,,,,,,,,,,,,,,,,,,,,,,,,,,,,,,,,,,,,,,,,,
